,Type,author,date,domain,gilded,id,nsfw,num_comments,num_crossposts,score,title,upvote_ratio,url
716,Top,Karma-Kosmonaut,2019-03-04 03:17:22,trofire.com,0,ax2973,False,1266,4,36585,Republicans Committed Massive Voter Fraud In North Carolina And Mitch McConnell Is Blaming Democrats,0.84,https://trofire.com/2019/03/03/republicans-committed-massive-voter-fraud-in-north-carolina-and-mitch-mcconnell-is-blaming-democrats/
717,Top,TYLER_WAS_ROBBED,2019-03-18 18:44:32,thehill.com,2,b2med6,False,4246,9,36570,Steve King deletes Facebook post asking who would win new US civil war,0.91,https://thehill.com/homenews/senate/434581-steve-king-deletes-facebook-post-asking-who-would-win-new-us-civil-war
718,Top,TYLER_WAS_ROBBED,2019-02-28 17:02:48,time.com,0,avteef,False,2234,4,36565,The President Has Been Implicated in a Crime. Statutes of Limitations Should Not Save Him.,0.84,http://time.com/5541213/donald-trump-michael-cohen-indictment/
719,Top,PoliticsModeratorBot,2019-04-18 15:12:36,self.politics,5,bempai,False,28892,5,36558,Megathread: Attorney General Releases Redacted Version of Special Counsel Report,0.9,https://www.reddit.com/r/politics/comments/bempai/megathread_attorney_general_releases_redacted/
720,Top,shabuluba,2019-01-08 00:37:54,vox.com,0,adoew9,False,1864,1,36550,Networks giving Trump free airtime on Tuesday refused to air Obama’s 2014 immigration speech,0.84,https://www.vox.com/policy-and-politics/2019/1/7/18172419/trump-immigration-speech-networks-obama
721,Top,OweMyDogMoney,2019-05-16 21:48:24,cnbc.com,5,bpindv,False,2271,5,36543,Michael Flynn told special counsel about attempts to obstruct Russia probe,0.9,https://www.cnbc.com/2019/05/16/michael-flynn-told-special-counsel-about-attempts-to-obstruct-russia-probe.html
722,Top,BEARlovesCOOKIE,2018-10-19 13:20:19,thehill.com,1,9pjqry,False,3493,3,36521,"107,000 purged from Georgia voter rolls for not voting in past elections",0.9,https://thehill.com/homenews/campaign/412195-georgia-purged-more-than-100000-people-from-voter-rolls-because-there-didnt
723,Top,a_very_nice_username,2019-01-05 17:01:13,huffingtonpost.com,1,acvuoj,False,2992,8,36508,Lots Of Us Think Trump Is A Motherf**ker Who Should Be Impeached. Rashida Tlaib Just Said It Out Loud.,0.75,https://www.huffingtonpost.com/entry/opinion-rashida-tlaib-trump-impeachment_us_5c2fc566e4b0d75a9830a875
724,Top,LemurDaddy,2018-08-22 14:49:51,nymag.com,1,99dyvx,False,2337,1,36490,Every Single House Republican Is Actively Covering Up Trump’s Guilt,0.86,http://nymag.com/daily/intelligencer/2018/08/every-house-republican-actively-covering-up-trumps-crimes.html
725,Top,romans310,2019-01-22 15:26:09,cnbc.com,1,ainvq9,False,6115,2,36465,Alexandria Ocasio-Cortez: A system that allows billionaires to exist alongside extreme poverty is immoral,0.74,https://www.cnbc.com/2019/01/22/alexandria-ocasio-cortez-a-system-that-allows-billionaires-to-exist-is-immoral.html
726,Top,Innocul8,2019-03-07 10:19:11,newsweek.com,0,ayb4fd,False,1868,4,36444,"Ivanka Trump Should Surrender Security Clearance Immediately, CNN Contributor Says: ‘She Is Living an Embarrassing Lie’",0.79,https://www.newsweek.com/ivanka-trump-jared-kushner-security-clearances-donald-trump-cnn-amanda-1354580
727,Top,Joe3737,2018-09-27 18:29:42,motherjones.com,1,9jfeao,False,4078,3,36448,Lindsey Graham Threatens to Falsify Accusations of Assault Against Democratic Supreme Court Nominees,0.81,https://www.motherjones.com/politics/2018/09/lindsey-graham-threatens-to-falsify-accusations-of-assault-against-democratic-supreme-court-nominees/
728,Top,Jump_Yossarian,2018-06-15 12:58:24,thehill.com,1,8raqqg,False,5288,3,36442,"Trump: Kim's people sit up when he speaks, 'I want my people to do the same'",0.87,http://thehill.com/homenews/administration/392430-trump-i-want-americans-to-listen-to-me-like-north-koreans-listen-to
729,Top,Normiesreeee69,2019-03-11 10:11:27,msnbc.com,0,azrp3l,False,2022,3,36422,Trump linked to 17 known investigations,0.81,https://www.msnbc.com/am-joy/watch/trump-linked-to-17-known-investigations-1455097923522?cid=sm_npd_ms_fb_ma&fbclid=IwAR2A1wEQXKBZLWdehe_IAXcQpWb9sWHGH7L-19wD-q426-KyYlVg-NgrFbU
730,Top,cram213,2019-03-29 09:26:59,npr.org,1,b6v3lu,False,2121,4,36427,"Poll: After Barr Letter, Overwhelming Majority Wants Full Mueller Report Released",0.9,https://www.npr.org/2019/03/29/707713994/poll-after-barr-letter-overwhelming-majority-wants-full-mueller-report-released
731,Top,RationalAnon,2018-11-23 16:19:55,cnbc.com,0,9zpkxe,False,1711,6,36412,Rep. Adam Schiff: House Democrats will investigate Trump's financial ties to Saudi Arabia as part of a 'deep dive' into the kingdom's dealings,0.88,https://www.cnbc.com/2018/11/23/adam-schiff-house-dems-will-investigate-trump-financial-ties-to-saudis.html
732,Top,thesesforty-three,2019-03-15 14:22:58,cnbc.com,0,b1fjw3,False,2352,3,36385,Trump says 'there should be no Mueller report' a day after House unanimously votes to make it public,0.92,https://www.cnbc.com/2019/03/15/trump-tweets-there-should-be-no-robert-mueller-russia-probe-report.html
733,Top,Treemailman,2019-04-18 19:14:33,slate.com,2,bephyb,False,3805,6,36377,Trump Obstructed Justice,0.81,https://slate.com/news-and-politics/2019/04/mueller-report-proves-trump-obstructed-justice.html
734,Top,ginger_bredman,2019-04-05 18:22:07,vox.com,0,b9uqa3,False,2260,7,36328,Senate Republicans can’t explain why they keep blocking a resolution calling for the release of the Mueller report,0.87,https://www.vox.com/policy-and-politics/2019/4/5/18295598/senate-republicans-resolution-mueller-report
735,Top,,2018-11-06 15:37:21,cnbc.com,1,9upbw8,False,3251,3,36313,Thousands of Students Are Expected to Walk Out of Classes Today to Go to The Polls,0.85,https://www.cnbc.com/2018/11/05/students-will-leave-classes-on-tuesday-as-part-of-the-walkout-to-vote.html
736,Top,Dizagaox,2019-01-06 16:48:57,thehill.com,0,ad776j,False,2249,5,36287,Snoop Dogg tells government workers affected by shutdown not to vote for Trump,0.79,https://thehill.com/blogs/in-the-know/in-the-know/424061-snoop-dogg-tells-government-workers-affected-by-shutdown-not-to
737,Top,SoulardSTL,2019-01-23 18:39:33,cnbc.com,1,aj2vnk,False,2894,4,36278,Michael Cohen postpones plan to testify at Congress because of fear for his family's safety,0.88,https://www.cnbc.com/2019/01/23/michael-cohen-postpones-plan-to-testify-at-congress-.html
738,Top,Treemailman,2019-03-21 18:33:06,independent.co.uk,0,b3u5mk,False,1948,4,36243,"Jared Kushner: Trump's son-in-law uses WhatsApp and personal email for official White House business, attorney says",0.92,https://www.independent.co.uk/news/world/americas/us-politics/jared-kushner-white-house-security-emails-ivanka-trump-whatsapp-a8834326.html?utm_medium=Social&utm_source=Twitter#Echobox=1553193153
739,Top,StrategicMindz,2019-04-02 12:17:46,independent.co.uk,3,b8igkb,False,3962,5,36246,Trump erupts over congress demand for Mueller report just hours before deadline for release,0.87,https://www.independent.co.uk/news/world/americas/us-politics/trump-mueller-report-twitter-deomcrats-subpoena-bill-clinton-starr-lewinsky-jerry-nadler-a8850831.html
740,Top,GlobalConcentrate7,2019-03-22 00:26:57,independent.co.uk,0,b3ya8d,False,4043,6,36242,Alexandria Ocasio-Cortez receives so many death threats her staff performs visitor risk assessments,0.85,https://www.independent.co.uk/news/world/americas/ocasio-cortez-death-threats-democrat-risk-assessment-security-staff-aoc-green-new-deal-trump-a8833751.html
741,Top,Ruebarbara,2019-02-05 11:22:43,slate.com,1,and67t,False,2036,12,36242,"Texas Republicans Are Lying About Voter Fraud to Justify a Massive, Racist Voter Purge",0.76,https://slate.com/news-and-politics/2019/02/texas-republicans-racist-illegal-voters-purge.html
742,Top,coldwarvetTempelhof,2019-02-07 13:59:23,businessinsider.com,0,ao3zrc,False,4809,5,36238,Alexandria Ocasio-Cortez introduces legislation for a 10-year Green New Deal plan to turn the US carbon neutral,0.78,https://www.businessinsider.com/alexandria-ocasio-cortez-green-new-deal-legislation-2019-2
743,Top,sbleezy,2018-12-16 00:58:20,motherjones.com,0,a6kq83,False,1991,3,36234,Beto O’Rourke Calls for “Public Pressure” on Trump to Close Child Migrant Camp,0.81,https://www.motherjones.com/politics/2018/12/beto-orourke-calls-for-public-pressure-on-trump-to-close-child-migrant-camp-1/
744,Top,ZoocarBlanco,2018-10-31 14:04:39,dallasnews.com,1,9sz0sb,False,4015,11,36220,I'm pro-life and I voted for Beto O'Rourke because I'm done being used by the GOP,0.75,https://www.dallasnews.com/opinion/commentary/2018/10/31/pro-life-voted-beto-orourke-done-used-gop
745,Top,_basquiat,2018-08-19 22:56:57,nytimes.com,1,98oegg,False,1832,3,36189,"Cohen, Trump’s Ex-Lawyer, Investigated for Bank Fraud in Excess of $20 Million",0.89,https://www.nytimes.com/2018/08/19/nyregion/michael-cohen-loans-donald-trump.html
746,Top,Bernie-Standards,2019-04-15 19:22:56,nydailynews.com,0,bdk84n,False,1671,16,36190,FDNY firefighter who survived 9/11 says Republican criticizing Ilhan Omar told him he was ‘too busy’ to talk victim benefits,0.85,https://www.nydailynews.com/news/politics/ny-texas-republican-ilhan-omar-fdny-firefighter-attack-20190411-qs7sbccinbd4zhirps2d7g6wpm-story.html?outputType=amp&__twitter_impression=true
747,Top,havenoideawatimdoin,2019-01-28 22:09:05,theroot.com,1,aksror,False,2037,2,36139,Sarah Huckabee Sanders Bravely Emerges From Her Crypt for the 1st White House Press Briefing in 41 Days,0.77,https://www.theroot.com/sarah-huckabee-sanders-bravely-emerges-from-her-crypt-f-1832133033
748,Top,CavePrisoner,2018-12-05 11:27:22,motherjones.com,0,a3bgbo,False,7896,5,36126,House Dems Will Push for Background Check on Every Gun Sale,0.86,https://www.motherjones.com/politics/2018/12/house-democrats-gun-control-background-checks/
749,Top,aggie_ftfy,2019-05-28 15:24:15,cnbc.com,1,bu1btl,False,3246,5,36174,Netflix says it will rethink its investment in Georgia if 'heartbeat' abortion law goes into effect,0.86,https://www.cnbc.com/2019/05/28/netflix-would-rethink-investment-in-georgia-if-abortion-law-stands.html
750,Top,RyanSmith,2019-01-28 16:29:40,newsweek.com,0,akp31r,False,2824,8,36102,"Joshua Tree Suffered 'Irreparable' Harm During Shutdown, Could Take 300 Years to Recover: Former Supervisor",0.89,https://www.newsweek.com/joshua-tree-government-shutdown-damage-vandalism-california-1307608
751,Top,zzzigzzzagzzziggy,2019-03-20 16:13:04,washingtonpost.com,0,b3dwf7,False,1317,2,36084,An Oklahoma sheriff quit in protest over dangerous jail conditions. So did all the deputies.,0.95,https://www.washingtonpost.com/nation/2019/03/20/an-oklahoma-sheriff-quit-protest-over-dangerous-jail-conditions-so-did-all-deputies/
752,Top,yam12,2019-04-04 12:58:13,independent.co.uk,0,b9cdwq,False,3540,4,36047,"Trump claims he suffers 'highest level of Presidential Harassment in history', despite assassination of four previous presidents",0.83,https://www.independent.co.uk/news/world/americas/us-politics/trump-twitter-harassment-president-assassination-jfk-lincoln-a8854811.html
753,Top,TheWeekMag,2019-03-15 21:12:03,theweek.com,1,b1k9zq,False,3721,4,36036,Trump just called immigration an 'invasion.' So did the New Zealand shooter.,0.78,https://theweek.com/speedreads/829486/trump-just-called-immigration-invasion-did-new-zealand-shooter
754,Top,__Hello_my_name_is__,2018-09-26 14:50:36,cnbc.com,13,9j360e,False,8583,9,36033,"Avenatti identifies Kavanaugh accuser as Washington resident Julie Swetnick, claims Supreme Court pick and pal tried to spike girls' drinks",0.89,https://www.cnbc.com/2018/09/26/michael-avenatti-identifies-kavanaugh-accuser-as-julie-swetnick.html
755,Top,madam1,2018-09-28 00:40:49,slate.com,1,9jidgl,False,5073,3,36014,"Brett Kavanaugh’s Testimony Made It Easier Than Ever to Picture Him As an Aggressive, Entitled Teen",0.74,https://slate.com/news-and-politics/2018/09/brett-kavanaugh-sexual-assault-hearing-teenager.html
756,Top,,2018-08-09 18:06:14,lgbtqnation.com,1,95yul3,False,1346,2,36001,Pence Said the President Should Resign for Lying About Adultery. Just Not This One.,0.88,https://www.lgbtqnation.com/2018/08/pence-said-president-resign-lying-adultery-just-not-one/
757,Top,PoliticsModeratorBot,2019-05-06 15:07:41,self.politics,0,bldba9,False,10196,0,35990,Megathread: House panel issues report citing Barr for contempt,0.88,https://www.reddit.com/r/politics/comments/bldba9/megathread_house_panel_issues_report_citing_barr/
758,Top,skjellyfetti,2018-11-21 12:18:02,huffingtonpost.com,0,9z2qap,False,3056,7,35982,Donald Trump Is An Accessory To Jamal Khashoggi’s Murder,0.74,https://www.huffingtonpost.com/entry/opinion-trump-khashoggi-mbs_us_5bf46ff2e4b0eb6d930915db
759,Top,OwnRules,2018-11-18 14:06:13,newsweek.com,0,9y66zi,False,2525,3,35951,"Trump's ""three-hour work day"" is over once a Democratic congress starts investigating, conservative CNN host says",0.83,https://www.newsweek.com/donald-trump-facing-rectal-exam-democrats-conservative-cnn-host-warns-1220981?utm_medium=Social&utm_campaign=NewsweekTwitter&utm_source=Twitter
760,Top,slaysia,2018-08-22 19:10:10,cnbc.com,7,99g6nq,False,2180,5,35947,"New York investigators have issued subpoena to former Trump lawyer Cohen as part of Trump Foundation probe, AP reports",0.91,https://www.cnbc.com/2018/08/22/new-york-investigators-have-issued-subpoena-to-former-trump-lawyer-cohen-as-part-of-trump-foundation-probe-ap-reports.html
761,Top,,2018-06-10 12:20:23,rollcall.com,2,8q0fxr,False,3856,6,35942,Warren Says Democrats Lack Guts to Take on ‘Billionaire Class’,0.87,https://www.rollcall.com/news/politics/warren-says-democrats-lack-guts-to-take-on-billionaire-class
762,Top,mayfield28,2018-11-20 20:12:39,washingtonpost.com,0,9yvu6a,False,2067,2,35936,‘Fox & Friends’ spent months blasting Hillary Clinton’s email use. Ivanka Trump got 25 seconds.,0.84,https://www.washingtonpost.com/politics/2018/11/20/fox-friends-spent-months-blasting-hillary-clintons-email-use-ivanka-trump-got-seconds/?utm_term=.8100d71b3c31
763,Top,zomboyyy,2018-08-03 21:58:49,apnews.com,1,94duxn,False,2563,1,35879,Report: Trump commission did not find widespread voter fraud,0.88,https://apnews.com/f5f6a73b2af546ee97816bb35e82c18d
764,Top,TJ_SP,2019-04-19 17:14:09,washingtonpost.com,1,bf1nw1,False,2938,7,35880,The Mueller report puts it beyond dispute: Trump is profoundly corrupt,0.84,https://www.washingtonpost.com/opinions/2019/04/19/mueller-report-puts-it-beyond-dispute-trump-is-profoundly-corrupt
765,Top,sivribiber,2019-01-02 10:16:09,usatoday.com,0,abs5pe,False,2221,8,35860,Trump illegally asked Russia to help him win in 2016. He shouldn't get away with it,0.75,https://www.usatoday.com/story/opinion/2019/01/02/trump-broke-law-russia-clinton-emails-hold-him-accountable-column/2449564002/
766,Top,NewsReady,2019-05-22 10:59:12,msnbc.com,1,brnbc7,False,2152,3,35850,Wife of lobbyist for Russian plant in KY got boost from McConnell: Maddow notes how the dots connect awkwardly for McConnell after the wife of the lobbyist who alerted McConnell to a huge Russian investment in Kentucky was suddenly processed for a federal judgeship for which she is not qualified.,0.89,https://www.msnbc.com/rachel-maddow/watch/wife-of-lobbyist-for-russian-plant-in-ky-got-boost-from-mcconnell-60082245958
767,Top,n1c4o7a5,2018-09-16 17:32:16,washingtonpost.com,3,9gcehv,False,5442,2,35810,"California professor, writer of confidential Brett Kavanaugh letter, speaks out about her allegation of sexual assault",0.85,https://www.washingtonpost.com/investigations/california-professor-writer-of-confidential-brett-kavanaugh-letter-speaks-out-about-her-allegation-of-sexual-assault/2018/09/16/46982194-b846-11e8-94eb-3bd52dfe917b_story.html
768,Top,demosthenes131,2018-08-09 12:50:38,mic.com,1,95w5i0,False,2316,1,35789,Today in Trump’s America: Rep. Devin Nunes admits to trying to protect Trump from legal jeopardy,0.88,https://mic.com/articles/190658/today-in-trumps-america-gop-congressmans-indictment-gives-democrats-new-message-for-midterms
769,Top,pablo-picasshole,2018-08-11 23:38:52,salon.com,0,96kxiv,False,2144,7,35769,Green Party candidate in Montana was on GOP payroll,0.87,https://www.salon.com/2018/08/11/green-party-candidate-in-montana-was-on-gop-payroll/
770,Top,The_Hoff901,2019-03-26 23:07:25,thehill.com,0,b5wqhh,False,3105,6,35759,Omar requests 'accountability' for GOP lawmaker who quoted Hitler on House floor,0.82,https://thehill.com/homenews/house/435950-omar-requests-accountability-for-gop-lawmaker-who-quoted-hitler-on-house-floor
771,Top,PrettyMuchAVegetable,2018-09-30 21:11:43,thestar.com,4,9ka1zr,False,3289,0,35754,Halifax cartoonist’s response to Kavanaugh hearing goes viral,0.83,https://www.thestar.com/news/canada/2018/09/30/halifax-cartoonists-response-to-kavanaugh-hearing-goes-viral.html
772,Top,Sepheus,2019-04-01 16:56:21,politico.com,0,b84zws,False,1630,4,35737,Don’t Wait For a Redacted Mueller Report | The law is clear: The House Judiciary Committee is entitled to the full 400 pages.,0.88,https://www.politico.com/magazine/story/2019/04/01/redacted-mueller-report-226343
773,Top,PrincipledInelegance,2019-01-10 12:00:27,theweek.com,0,aeig0t,False,3104,7,35737,Fox News Shep Smith and Andrew Nepolitano now see proof of 'collusion' between Trump's team and Russia,0.84,https://theweek.com/speedreads-amp/816826/fox-news-shep-smith-andrew-napolitano-now-proof-collusion-between-trumps-team-russia?__twitter_impression=true
774,Top,SplodeyDope,2019-02-02 12:05:12,thenation.com,1,amdi7x,False,8569,5,35741,Democrats Need to Make Getting Rid of the Electoral College a Top Priority - Two Republican losers have “won” the presidency in 16 years—that should be a lesson for Democrats.,0.64,https://www.thenation.com/article/democrats-need-to-get-rid-of-the-electoral-college/
775,Top,diverguyy93,2018-11-23 00:57:26,nypost.com,0,9zjnyt,False,1504,4,35705,CIA has recording of MBS saying ‘silence Jamal Khashoggi’: report,0.92,https://nypost.com/2018/11/22/cia-has-recording-of-mbs-saying-silence-jamal-khashoggi-report/
776,Top,here_comes_mueller,2018-08-11 15:47:48,edition.cnn.com,0,96hhlf,False,2674,1,35664,Poll: Trump is as strongly disliked now as Nixon was before he resigned,0.82,https://edition.cnn.com/2018/08/11/politics/poll-of-the-week-trump-nixon/index.html?utm_source=feedburner&utm_medium=feed&utm_campaign=Feed%3A+rss%2Fcnn_latest+%28RSS%3A+CNN+-+Most+Recent%29
777,Top,Baarney23,2018-10-28 11:58:26,slate.com,0,9s2mzd,False,2653,7,35656,Trump Lies About Sept. 11 to Justify Holding Campaign Rally After Synagogue Shooting,0.79,https://slate.com/news-and-politics/2018/10/trump-falsely-says-nyse-opened-day-after-sept-11-to-justify-holding-campaign-rally-after-synagogue-shooting.html
778,Top,spsheridan,2018-06-13 14:29:00,abcnews.go.com,0,8qsuqc,False,5003,1,35639,Ex-Trump lawyer Cohen likely to cooperate as his attorneys leave case: Sources,0.9,https://abcnews.go.com/US/trump-lawyer-michael-cohen-cooperate-attorneys-leave-case/story?id=55861988
779,Top,Hoxha_Posadist,2019-04-02 11:03:15,commondreams.org,3,b8hr95,False,3354,9,35628,"'Time to Act': Nationwide Protests Planned If Barr Fails to Release Full Mueller Report By Tonight - ""Barr has offered an alternate timeline for a redacted version of the report—but we deserve the full report and congressional leaders and the American people expect it now.""",0.84,https://www.commondreams.org/news/2019/04/02/time-act-nationwide-protests-planned-if-barr-fails-release-full-mueller-report
780,Top,alfosn,2019-02-10 11:30:14,theguardian.com,5,ap35h8,False,2742,7,35608,"In revering Trump, the religious right has laid bare its hypocrisy",0.78,https://www.theguardian.com/commentisfree/2019/feb/10/in-revering-trump-the-religious-right-has-laid-bare-its-hypocrisy
781,Top,Barack_Odrama90,2018-08-13 13:55:54,cnn.com,1,96yhua,False,1491,2,35606,Trump-appointed judge upholds special counsel Mueller's authority,0.91,https://www.cnn.com/2018/08/13/politics/robert-mueller-concord-management-and-consulting/index.html
782,Top,Ray3142,2018-08-29 20:01:39,beyer.house.gov,2,9bcp45,False,2240,3,35604,Beyer On IG Revelations Of Trump’s Involvement In FBI Headquarters Decision: “This Looks Like A Cover-Up”,0.89,https://beyer.house.gov/news/documentsingle.aspx?DocumentID=1019
783,Top,zsreport,2019-01-25 12:03:19,popularmechanics.com,1,ajod7w,False,2599,7,35596,President of Flight Attendants Union Suggests General Strike to End Government Shutdown,0.94,https://www.popularmechanics.com/flight/airlines/a26009774/government-shutdown-general-strike/
784,Top,Another-Chance,2018-10-31 20:25:06,10tv.com,1,9t2ji5,False,1145,5,35585,Federal judges order Ohio to allow purged voters back in,0.91,https://www.10tv.com/article/federal-judges-order-ohio-allow-purged-voters-back
785,Top,emitremmus26,2018-06-21 17:41:20,vox.com,1,8stw7n,False,2339,5,35583,Sinclair forced its TV stations to air pro-Trump propaganda on family separation,0.88,https://www.vox.com/2018/6/21/17488540/sinclair-tv-stations-family-separation-propaganda
786,Top,AFWxGuy,2018-12-12 21:36:56,thehill.com,0,a5mmna,False,2364,5,35571,Fox’s Napolitano: We learned today that prosecutors have evidence Trump committed a felony,0.89,https://thehill.com/homenews/administration/421083-foxs-napolitano-we-learned-today-that-prosecutors-have-evidence-trump
787,Top,,2018-08-27 13:51:48,newsweek.com,1,9ap3o9,False,4446,7,35569,"Donald Trump is the worst president ever, 41 percent of Americans say in poll",0.79,https://www.newsweek.com/donald-trump-worst-president-ever-41-percent-americans-say-new-poll-1091223
788,Top,Fitbitnitwit,2018-11-14 10:31:32,theweek.com,0,9wyye0,False,3681,3,35536,"Trump has reportedly 'retreated into a cocoon of bitterness and resentment' after mounting midterm losses, France",0.82,https://theweek.com/speedreads/807616/trump-reportedly-retreated-into-cocoon-bitterness-resentment-after-mounting-midterm-losses-france
789,Top,aoi_to_midori,2018-07-19 19:23:32,washingtonpost.com,1,908wxt,False,1675,4,35541,Putin appears to be targeting U.S. officials who worked to sanction Russia,0.9,https://www.washingtonpost.com/world/national-security/putin-appears-to-be-targeting-us-officials-who-worked-to-sanction-russia/2018/07/19/289059ac-8b67-11e8-8aea-86e88ae760d8_story.html?utm_term=.22e33046a8a0
790,Top,wonderingsocrates,2018-10-05 00:29:50,washingtonpost.com,0,9lhj6q,False,2376,4,35523,We were Brett Kavanaugh’s drinking buddies. We don’t think he should be confirmed.,0.79,https://www.washingtonpost.com/opinions/we-were-brett-kavanaughs-drinking-buddies-we-dont-think-he-should-be-confirmed/2018/10/04/923cf6ac-c821-11e8-b2b5-79270f9cce17_story.html?utm_term=.e223d2401c32
791,Top,an_actual_lawyer,2018-10-20 16:27:36,lawandcrime.com,1,9pvh78,False,2011,5,35502,GOP Removes Sole Polling Place From Famous Hispanic Majority City in Kansas,0.88,https://lawandcrime.com/civil-rights/gop-removes-sole-polling-place-from-famous-hispanic-majority-city-in-kansas/
792,Top,smartwn,2019-01-09 17:42:35,talkingpointsmemo.com,0,ae98ch,False,2362,7,35496,More People Tuned In To Watch Dem Rebuttal Than Trump’s Address,0.83,https://talkingpointsmemo.com/news/more-tuned-in-watch-dem-rebuttal-trump-address
793,Top,mvanigan,2019-03-27 14:17:52,thehill.com,0,b6513r,False,3034,9,35410,McConnell blocks resolution calling for release of Mueller report for second time,0.91,https://thehill.com/blogs/floor-action/senate/436006-mcconnell-blocks-resolution-calling-for-release-of-mueller-report
794,Top,alt213,2019-04-11 13:08:28,cnbc.com,2,bbzo4g,False,4321,7,35401,Democratic presidential candidate Elizabeth Warren wants to raise $1 trillion in revenue with a new 7% tax on corporate profits over $100 million,0.85,https://www.cnbc.com/2019/04/11/elizabeth-warren-targets-corporate-profits-with-new-7percent-surtax-proposal.html
795,Top,StevenSanders90210,2019-03-26 10:48:45,washingtonpost.com,1,b5o666,False,4626,12,35389,GOP congressman quotes Hitler’s ‘Mein Kampf’ to slam Trump’s adversaries as liars,0.84,https://www.washingtonpost.com/nation/2019/03/26/gop-congressman-quotes-hitlers-mein-kampf-slam-trumps-adversaries-liars/?utm_term=.a27eda82bc1a#click=https://t.co/ZgrcGEm9Kt
796,Top,SamDumberg,2018-10-27 20:11:42,axios.com,3,9rxbyv,False,2354,9,35364,"Reports: Votes in Texas, Georgia are being changed at polls",0.87,https://www.axios.com/votes-texas-georgia-changed-polls-election-security-midterms-2018-a70ea590-5e97-409c-922b-d74792a49e1c.html
797,Top,coolandfool,2018-09-18 11:40:20,thehill.com,0,9gu1um,False,1852,8,35357,Florida governor booed out of restaurant over red tide algae issues,0.9,https://thehill.com/homenews/state-watch/407141-florida-governor-booed-out-of-restaurant-over-red-tide-algae-issues
798,Top,anarchytravel,2019-05-04 19:02:17,cnbc.com,0,bkoijp,False,1376,4,35352,"Warren Buffett: If a bank needs a government bailout, the CEO and spouse should lose 'net worth'",0.93,https://www.cnbc.com/2019/05/04/warren-buffett-if-a-bank-needs-a-government-bailout-the-ceo-and-spouse-should-lose-net-worth.html
799,Top,wonderingsocrates,2018-12-15 03:02:20,thedailybeast.com,1,a6booq,False,1018,3,35334,Trump’s Next Chief of Staff Called Him ‘A Terrible Human Being’ Just Before He Was Elected President,0.88,https://www.thedailybeast.com/trumps-next-chief-of-staff-called-him-a-terrible-human-being-just-before-he-was-elected-president?source=articles&via=rss
800,Top,FetcherLeVache,2018-09-12 17:44:14,slate.com,1,9f9xwf,False,2508,3,35327,Susan Collins Complains of “Bribery” After Nonbillionaires Try to Influence Her Kavanaugh Vote,0.89,https://slate.com/news-and-politics/2018/09/susan-collins-complains-of-bribery-after-nonbillionaires-try-to-influence-her-kavanaugh-vote.html
