,Type,author,date,domain,gilded,id,nsfw,num_comments,num_crossposts,score,title,upvote_ratio,url
0,Top,FuegoFerdinand,2018-11-07 01:02:55,kentucky.com,1,9uuhl3,False,2771,15,101991,"Kim Davis, clerk who refused to sign marriage licenses for gay couples, loses to Democrat",0.83,https://www.kentucky.com/news/politics-government/article221121745.html
1,Top,Bloodbath-McGrath,2018-11-19 23:35:44,washingtonpost.com,4,9ymbzc,False,6518,6,89834,Ivanka Trump used a personal email account to send hundreds of emails about government business last year,0.83,https://www.washingtonpost.com/politics/ivanka-trump-used-a-personal-email-account-to-send-hundreds-of-emails-about-government-business-last-year/2018/11/19/6515d1e0-e7a1-11e8-a939-9469f1166f9d_story.html
2,Top,Eurynom0s,2019-01-12 01:21:08,nytimes.com,30,af2foq,False,7979,11,87752,F.B.I. Opened Inquiry Into Whether Trump Was Secretly Working on Behalf of Russia,0.81,https://www.nytimes.com/2019/01/11/us/politics/fbi-trump-russia-inquiry.html
3,Top,emitremmus27,2019-01-15 16:34:05,thehill.com,1,agabcf,False,7546,9,85187,McConnell blocks House bill to reopen government for second time,0.85,https://thehill.com/homenews/senate/425414-mcconnell-blocks-house-bill-to-reopen-government-for-second-time
4,Top,PoliticsModeratorBot,2019-01-18 03:56:54,self.politics,36,ah6gxc,False,29963,9,84420,Megathread: President Trump Directed His Attorney To Lie To Congress About The Moscow Tower Project,0.81,https://www.reddit.com/r/politics/comments/ah6gxc/megathread_president_trump_directed_his_attorney/
5,Top,emitremmus27,2019-02-06 21:00:32,thehill.com,0,anvgkw,False,2267,16,84329,"Ohio city to stop observing Columbus Day, make Election Day holiday instead",0.85,https://thehill.com/homenews/state-watch/428808-ohio-city-to-stop-observing-columbus-day-make-election-day-a-holiday
6,Top,RationalAnon,2018-12-22 19:26:41,newsweek.com,2,a8nmov,False,4056,11,83384,Alexandria Ocasio-Cortez Says Lawmakers Should Lose Their Salaries Too When They Shut Down the Government,0.86,https://www.newsweek.com/alexandria-ocasio-cortez-says-lawmaker-should-lose-salaries-too-during-1269591
7,Top,WagTheKat,2018-11-08 00:39:22,commondreams.org,56,9v57rh,False,8326,32,82866,'A Red Line Crossed': Nationwide Protests Declared for Thursday at 5PM After Jeff Sessions Fired,0.81,https://www.commondreams.org/news/2018/11/07/red-line-crossed-nationwide-protests-declared-thursday-5pm-after-jeff-sessions-fired
8,Top,thesesforty-three,2019-03-10 00:57:23,ijr.com,7,azad2b,False,3827,12,80403,Resurfaced Video Shows Bernie Sanders Criticizing Media for Not Covering Climate Change in 1989,0.79,https://ijr.com/resurfaced-video-bernie-sanders-climate-change-1989/
9,Top,slingtarp,2018-10-28 23:11:45,thehill.com,1,9s7qss,False,5587,10,76974,Jewish leaders tell Trump he's not welcome in Pittsburgh until he denounces white nationalism,0.76,https://thehill.com/homenews/administration/413558-jewish-leaders-say-trumps-not-welcome-in-pittsburgh-until-he
10,Top,TheWeekMag,2019-03-14 15:09:52,theweek.com,1,b11g3m,False,3864,18,75820,House votes 420-0 to make Mueller's report public,0.93,https://theweek.com/speedreads/829157/house-votes-4200-make-muellers-report-public
11,Top,Bogartsboss,2018-11-06 17:16:08,thehill.com,0,9uq8jc,False,3264,3,73860,"Majority says Election Day should be a federal holiday, poll finds",0.9,https://thehill.com/hilltv/what-americas-thinking/415065-majority-say-election-day-should-be-a-federal-holiday-poll
12,Top,Bogartsboss,2018-10-26 21:55:53,thehill.com,2,9rp138,False,3752,7,73858,Obama: If Republicans really cared about Clinton's emails they would be 'up in arms' over Trump's iPhone,0.8,https://thehill.com/blogs/blog-briefing-room/news/413423-obama-if-republicans-cared-about-clintons-emails-they-would-be
13,Top,progress18,2018-12-07 22:46:58,lawandcrime.com,12,a45167,False,5273,6,71736,Federal Prosecutors ‘Concluded that President of the United States Committed a Felony’,0.85,https://lawandcrime.com/high-profile/federal-prosecutors-concluded-that-president-of-the-united-states-committed-a-felony/
14,Top,Ayrane,2019-01-04 02:31:02,thehill.com,2,acdf42,False,5791,8,69307,"Dem introduces bills to eliminate electoral college, stop presidents from pardoning themselves",0.8,https://thehill.com/homenews/house/423810-dem-introduces-bills-to-eliminate-electoral-college-stop-presidents-from
15,Top,presspower,2019-05-30 12:08:47,independent.co.uk,11,buscyw,False,7352,7,69573,Trump says Russia 'helped me get elected' for first time in furious outburst at Mueller,0.85,https://www.independent.co.uk/news/world/americas/us-politics/trump-twitter-mueller-statement-russia-impeachment-collusion-obstruction-a8936496.html
16,Top,JohnBasedow_,2019-01-13 19:53:58,newsweek.com,10,afn2r2,False,6448,25,68973,"Mueller Draft Report says Trump 'Helped Putin Destabilize the United Sates', Watergate Journalist says",0.8,https://www.newsweek.com/mueller-report-trump-helped-putin-destabilize-us-watergate-journalist-1289541?utm_campaign=NewsweekTwitter&utm_medium=Social&utm_source=Twitter&__twitter_impression=true
17,Top,Baarney23,2018-12-26 13:42:06,thehill.com,2,a9ona8,False,2581,6,68549,Dan Rather asks Trump what’s more ‘marginal’: ‘Believing in Santa at age 7 or not believing in climate change at age 72?,0.81,http://thehill.com/blogs/blog-briefing-room/news/422856-dan-rather-asks-trump-whats-more-marginal-believing-in-santa-at
18,Top,danielthetemp,2019-01-12 23:17:30,washingtonpost.com,10,afd0eh,False,4761,7,67990,Trump has concealed details of his face-to-face encounters with Putin from senior officials in administration,0.82,https://www.washingtonpost.com/world/national-security/trump-has-concealed-details-of-his-face-to-face-encounters-with-putin-from-senior-officials-in-administration/2019/01/12/65f6686c-1434-11e9-b6ad-9cfd62dbb0a8_story.html?utm_term=.2ddaaa3b605e
19,Top,PoliticsModeratorBot,2018-11-29 14:34:14,self.politics,8,a1htyo,False,14507,5,67764,Megathread: Michael Cohen pleads guilty to lying to Congress about Trump real estate project in Russia,0.87,https://www.reddit.com/r/politics/comments/a1htyo/megathread_michael_cohen_pleads_guilty_to_lying/
20,Top,a_very_nice_username,2019-01-21 16:51:23,commondreams.org,0,aibyha,False,3985,8,67446,"'Literally What Jesus Told People to Do': In Arizona, Possible Prison Time for Leaving Food and Water for Migrants — ""If giving water to someone dying of thirst is illegal, what humanity is left in the law of this country?""",0.8,https://www.commondreams.org/news/2019/01/21/literally-what-jesus-told-people-do-arizona-possible-prison-time-leaving-food-and
21,Top,kerovon,2018-11-29 22:56:12,buzzfeednews.com,21,a1mfip,False,5175,14,67332,The Trump Organization Planned To Give Vladimir Putin The $50 Million Penthouse In Trump Tower Moscow,0.84,https://www.buzzfeednews.com/article/anthonycormier/the-trump-organization-planned-to-give-vladimir-putin-the
22,Top,nrmlgir111,2019-02-12 15:31:37,newsweek.com,1,apuh2g,False,4779,9,67173,Alexandria Ocasio-Cortez's 'Corruption Game' Speech Is Now the Most Viewed Twitter Video of Any Politician,0.76,https://www.newsweek.com/alexandria-ocasio-cortezs-corruption-game-speech-now-most-viewed-video-any-1327816
23,Top,ONE-OF-THREE,2019-03-08 17:23:57,thehill.com,1,ayssub,False,2502,3,67151,House passes bill to require presidents to disclose their tax returns,0.86,https://thehill.com/policy/finance/433221-house-passes-bill-to-require-presidents-to-disclose-their-tax-returns
24,Top,PoliticsModeratorBot,2019-02-19 13:21:00,self.politics,53,asac31,False,39128,13,67118,Megathread: Bernie Sanders announces 2020 presidential run,0.72,https://www.reddit.com/r/politics/comments/asac31/megathread_bernie_sanders_announces_2020/
25,Top,darkfires,2018-07-25 03:21:56,msnbc.com,10,91o8lt,False,3700,10,66867,Trump White House edits Putin support for Trump out of transcript and video,0.89,http://www.msnbc.com/rachel-maddow/watch/trump-white-house-edits-putin-support-for-trump-out-of-transcript-1284716611545
26,Top,speckz,2018-10-15 19:59:44,motherboard.vice.com,2,9og7al,False,2064,8,66808,99.7 Percent of Unique FCC Comments Favored Net Neutrality,0.9,https://motherboard.vice.com/en_us/article/3kmedj/997-percent-of-unique-fcc-comments-favored-net-neutrality
27,Top,The-Autarkh,2018-12-27 19:27:43,businessinsider.com,0,aa2aq9,False,4245,3,66619,"Most Americans would rather spend the $5 billion Trump is demanding for the border wall on infrastructure, education, or healthcare",0.79,https://www.businessinsider.com/government-shutdown-poll-ocasio-cortez-ideas-for-trump-border-wall-money-2018-12
28,Top,speckz,2018-12-05 14:50:49,dailydot.com,1,a3cy0k,False,2491,11,66498,Ajit Pai admits Russia interfered in net neutrality process amidst lawsuit,0.91,https://www.dailydot.com/layer8/net-neutrality-comments-lawsuit/
29,Top,slakmehl,2019-03-07 00:06:00,nbcsandiego.com,7,ay5zm0,False,2707,11,65968,Source: Leaked Documents Show the U.S. Government Tracking Journalists and Immigration Advocates Through a Secret Database,0.87,https://www.nbcsandiego.com/investigations/Source-Leaked-Documents-Show-the-US-Government-Tracking-Journalists-and-Advocates-Through-a-Secret-Database-506783231.html
30,Top,PoliticsModeratorBot,2019-01-25 11:33:39,self.politics,13,ajo5lj,False,21813,11,65942,Megathread: Ex-Trump adviser Roger Stone arrested in Mueller probe,0.86,https://www.reddit.com/r/politics/comments/ajo5lj/megathread_extrump_adviser_roger_stone_arrested/
31,Top,Kujobites,2019-03-04 20:26:12,thehill.com,2,axbw4z,False,2368,7,65597,Pelosi says Democrats to introduce bill to bring back net neutrality this week,0.86,https://thehill.com/policy/technology/432519-pelosi-says-democrats-to-introduce-net-neutrality-bill-this-week
32,Top,Fr1sk3r,2019-02-08 11:51:07,huffingtonpost.com,18,aofry1,False,8662,24,64869,Alexandria Ocasio-Cortez Exposes The Dark Side Of Politics In 5 Incredible Minutes,0.73,https://www.huffingtonpost.com/entry/alexandria-ocasio-cortez-campaign-finance_us_5c5d246be4b03afe8d6637ff
33,Top,Intern3,2019-01-02 19:29:52,cnn.com,0,abwpmr,False,4028,9,63802,Democrats to ask for 10 years of presidential tax returns in new bill,0.83,https://www.cnn.com/2019/01/02/politics/trump-tax-returns-democrats/index.html
34,Top,The-Autarkh,2018-10-22 23:38:25,businessinsider.com,0,9qjces,False,5360,9,63282,Obama: 'There's a pattern' of Republicans running the economy 'into the ground' and Democrats having to 'come back and clean things up',0.72,https://www.businessinsider.com/obama-on-republicans-democrats-recessions-and-trump-economy-claims-2018-10
35,Top,haxamin,2019-03-17 00:01:56,thehill.com,0,b1z3fv,False,4285,5,63240,Washington Senate passes bill that would keep Trump off 2020 ballot unless he releases tax returns,0.86,https://thehill.com/homenews/state-watch/434412-washington-senate-passes-bill-that-would-keep-trump-off-2020-ballot
36,Top,_basquiat,2019-02-05 18:20:24,gq.com,2,angyvd,False,4730,21,63153,Fox News Hosts Are Horrified to Learn Their Own Polls Show People Want to Tax the Rich,0.78,https://www.gq.com/story/fox-news-tax-poll-fairness
37,Top,GOPniks2,2019-05-24 18:49:36,independent.co.uk,6,bsknt4,False,6441,13,62923,Trump invokes emergency powers to sidestep congress and sell arms to Saudi Arabia,0.9,https://www.independent.co.uk/news/world/americas/us-politics/trump-saudi-arabia-deal-bombs-uae-arms-trade-congress-yemen-a8929741.html
38,Top,staceyabrams,2018-10-12 18:26:59,self.politics,8,9nmrxh,False,3072,7,62736,"Hi, I'm Stacey Abrams. If I win my ""toss up"" Georgia gubernatorial race, I'll be the first Black woman governor in America. Ask Me Anything!",0.78,https://www.reddit.com/r/politics/comments/9nmrxh/hi_im_stacey_abrams_if_i_win_my_toss_up_georgia/
39,Top,throwaway5272,2019-01-12 16:08:38,nymag.com,1,af8pb4,False,4868,12,62319,Robert Mueller Is Investigating President Trump as a Russian Asset,0.81,http://nymag.com/intelligencer/2019/01/mueller-investigating-trump-russian-asset.html
40,Top,slakmehl,2018-08-22 01:16:19,newyorker.com,3,998zhc,False,5643,6,62015,The President Has Been Implicated in a Criminal Conspiracy,0.84,https://www.newyorker.com/news-desk/swamp-chronicles/the-president-has-been-implicated-in-a-criminal-conspiracy
41,Top,jjlew080,2018-07-20 15:40:37,nytimes.com,6,90h15n,False,8260,13,61626,Michael Cohen Secretly Taped Trump Discussing Payment to Playboy Model,0.88,https://www.nytimes.com/2018/07/20/us/politics/michael-cohen-trump-tape.html
42,Top,nanopicofared,2019-05-07 22:54:58,nytimes.com,16,blxij3,False,6689,11,61621,Decade in the Red: Trump Tax Figures Show Over $1 Billion in Business Losses,0.86,https://www.nytimes.com/interactive/2019/05/07/us/politics/donald-trump-tax-returns.html
43,Top,JigsawMuzzle,2019-04-17 12:32:42,huffpost.com,11,be78fw,False,5865,23,61608,Stunning Supercut Video Exposes The Fox News Double Standard On Trump And Obama — Clips show Fox News personalities slamming Obama for the same things Trump does now.,0.84,https://www.huffpost.com/entry/fox-news-obama-trump-double-standard_n_5cb6a8c0e4b0ffefe3b8ce3e?m=false
44,Top,PoliticsModeratorBot,2018-12-12 17:17:08,self.politics,3,a5k502,False,15607,1,61539,Megathread: Ex-Trump lawyer Cohen gets 3 years in prison for crimes including hush-money payments that prosecutors say Trump ordered,0.87,https://www.reddit.com/r/politics/comments/a5k502/megathread_extrump_lawyer_cohen_gets_3_years_in/
45,Top,Bogartsboss,2019-01-09 21:15:16,thehill.com,1,aebg64,False,4952,4,61529,Pelosi says Trump doesn't get shutdown's effect on workers: 'He thinks maybe they could just ask their father for more money',0.78,https://thehill.com/homenews/administration/424607-pelosi-says-trump-doesnt-get-shutdowns-effect-on-workers-he-thinks
46,Top,Cobrakai469,2019-02-19 01:20:36,bbc.com,1,as4o7s,False,4005,6,61437,16 states sue President Trump over border wall,0.8,https://www.bbc.com/news/world-us-canada-47287738
47,Top,PoliticsModeratorBot,2019-03-22 21:07:04,self.politics,28,b4agza,False,32468,3,61313,Megathread: Mueller files final report with Attorney General,0.91,https://www.reddit.com/r/politics/comments/b4agza/megathread_mueller_files_final_report_with/
48,Top,Ray3142,2019-01-04 15:37:05,teddeutch.house.gov,9,acj9lt,False,3173,7,60937,Bipartisan Constitutional Amendment to Overturn Citizens United Introduced,0.92,https://teddeutch.house.gov/news/documentsingle.aspx?DocumentID=399461
49,Top,Armchair_QB3,2018-07-25 17:45:10,lawandcrime.com,2,91u1nr,False,3562,5,60556,White House May Have Broken Federal Law by Doctoring Trump-Putin Video,0.84,https://lawandcrime.com/legal-analysis/white-house-may-have-broken-federal-law-by-doctoring-trump-putin-video/
50,Top,Sepheus,2018-11-16 15:27:52,cnn.com,1,9xn44s,False,4622,4,60406,Judge orders White House to return Jim Acosta's press pass,0.85,https://www.cnn.com/2018/11/16/media/cnn-trump-lawsuit-hearing/index.html
51,Top,lsThisReaILife,2018-12-14 00:47:00,washingtonpost.com,3,a5zp0b,False,7212,11,60205,"7-year-old migrant girl taken into Border Patrol custody dies of dehydration, exhaustion",0.78,https://www.washingtonpost.com/world/national-security/7-year-old-migrant-girl-taken-into-border-patrol-custody-dies-of-dehydration-exhaustion/2018/12/13/8909e356-ff03-11e8-862a-b6a6f3ce8199_story.html
52,Top,thewateroflife,2019-03-09 11:53:03,motherjones.com,1,az2r7x,False,3139,9,59878,A Florida Massage Parlor Owner Has Been Selling Chinese Execs Access to Trump at Mar-a-Lago,0.84,https://www.motherjones.com/politics/2019/03/a-florida-massage-parlor-owner-has-been-selling-chinese-execs-access-to-trump-at-mar-a-lago/
53,Top,Cadet-Bone-Spurs,2018-11-12 19:50:19,washingtonpost.com,1,9whey7,False,2850,11,59735,Trump is telling Florida to ignore military ballots. Happy Veterans Day.,0.82,https://www.washingtonpost.com/outlook/2018/11/12/trump-is-telling-florida-ignore-military-ballots-happy-veterans-day/?noredirect=on&utm_term=.6eb4e4f2c8be
54,Top,slaysia,2019-02-27 19:32:31,thedailybeast.com,3,avhcxs,False,2730,3,59504,Matt Gaetz Under Investigation By Florida State Bar Over Michael Cohen Threat,0.86,https://www.thedailybeast.com/matt-gaetz-under-investigation-by-florida-state-bar-over-michael-cohen-threat
55,Top,Nutjob18,2019-01-25 01:20:33,nbcnews.com,2,ajjqbh,False,1955,6,59443,"Officials rejected Jared Kushner for top secret security clearance, but were overruled",0.87,https://www.nbcnews.com/politics/donald-trump/officials-rejected-jared-kushner-top-secret-security-clearance-were-overruled-n962221
56,Top,PrincipledInelegance,2018-10-29 19:57:30,newsweek.com,0,9sgmqo,False,5627,7,59381,"Sarah Huckabee Sanders claims Donald Trump won the popular vote by ""overwhelming majority,"" when he lost by millions",0.81,https://www.newsweek.com/sarah-huackabee-sanders-donald-trump-popular-vote-1192395
57,Top,scrotum_pot_pie,2019-03-25 21:24:56,axios.com,1,b5gnfl,False,5995,12,59192,McConnnell blocks resolution to release full Mueller report,0.88,https://www.axios.com/mcconnnell-blocks-resolution-release-mueller-report-public-ac30a037-2c00-4cc5-8a78-9e6c6122c44b.html
58,Top,singularfate,2018-11-27 00:03:32,talkingpointsmemo.com,1,a0p6c5,False,4430,4,59189,Mueller: Manafort Has Lied To Investigators Since Plea Deal,0.85,https://talkingpointsmemo.com/muckraker/mueller-manafort-has-lied-to-investigators-since-plea-deal
59,Top,geoxol,2019-02-22 19:30:25,nymag.com,2,atlqlr,False,2084,11,59083,GOP Finally Has Documented Case of Election Fraud — Committed by Republicans,0.81,http://nymag.com/intelligencer/2019/02/election-fraud-is-real-and-it-involves-a-republican.html
60,Top,SuccessfulOperation,2018-12-12 21:11:01,dailydot.com,0,a5mdt8,False,2673,4,58963,Sean Hannity busted deleting all his old Michael Cohen tweets,0.87,https://www.dailydot.com/layer8/sean-hannity-deleting-michael-cohen-tweets/
61,Top,Cadet-Bone-Spurs,2019-02-24 21:04:43,rollingstone.com,0,auck5l,False,4969,4,58724,Bernie Sanders Politely Asks Supporters Not to Harass His Opponents,0.81,https://www.rollingstone.com/politics/politics-news/bernie-sanders-email-supporters-799468/
62,Top,vwboyaf1,2018-08-26 23:21:48,washingtonpost.com,2,9ajyz6,False,4686,5,58649,Trump rejected plans for a White House statement praising McCain,0.84,https://www.washingtonpost.com/politics/trump-rejected-plans-for-a-white-house-statement-praising-mccain/2018/08/26/0d0478e4-a967-11e8-8f4b-aee063e14538_story.html?utm_term=.f0c1eb8b6b25
63,Top,Demon-Rat,2018-11-09 00:00:24,motherjones.com,3,9vfexr,False,3548,4,58573,#ProtectMueller Protesters Shut Down Streets in Midtown Manhattan: “We Have to Resist”,0.81,https://www.motherjones.com/politics/2018/11/crowds-are-gathering-in-times-square-for-protect-mueller-rally-sessions-new-york/
64,Top,lobsterbash,2019-05-08 16:06:10,thehill.com,9,bm7364,False,3081,10,58568,Schiff Introduces Constitutional Amendment to Overturn Citizens United,0.91,https://thehill.com/homenews/house/442697-schiff-introduces-constitutional-amendment-to-overturn-citizens-united
65,Top,lodestar_resistance,2018-12-31 16:29:51,theweek.com,0,ab8m61,False,2557,10,58440,An Alabama sheriff personally kept $1.5 million that was supposed to feed ICE detainees,0.89,https://theweek.com/speedreads/815161/alabama-sheriff-personally-kept-15-million-that-supposed-feed-ice-detainees
66,Top,RationalAnon,2018-12-13 20:45:35,nbcnews.com,1,a5xhc1,False,3890,3,58366,"Trump was in the room during hush money discussions, NBC News confirms",0.85,https://www.nbcnews.com/politics/justice-department/trump-was-room-during-hush-money-discussions-nbc-news-confirms-n947536
67,Top,lobsterbash,2019-02-08 15:49:23,vox.com,10,aohstr,False,6351,5,58089,Alexandria Ocasio-Cortez’s “lightning round” on money in politics goes viral,0.76,https://www.vox.com/policy-and-politics/2019/2/8/18216884/alexandria-ocasio-cortez-video-campaign-finance
68,Top,AgentMouse,2018-08-05 14:45:33,thinkprogress.org,4,94sc3q,False,5107,4,58079,"For the first time, Trump confesses that his campaign turned to Russia for help",0.86,https://thinkprogress.org/for-the-first-time-trump-confesses-that-his-campaign-turned-to-russia-for-help-1add0c286eba/
69,Top,Drmanka,2019-02-28 00:06:04,marketwatch.com,2,avke04,False,3563,8,58064,Fordham confirms that Trump team threatened the school if his grades became public,0.84,https://www.marketwatch.com/story/fordham-confirms-that-trump-team-threatened-the-school-if-his-grades-became-public-2019-02-27
70,Top,Demon-Rat,2018-11-12 14:15:39,thinkprogress.org,1,9wecwv,False,4063,6,58044,"Kyrsten Sinema wins, will become the first Democratic senator from Arizona in a quarter century",0.85,https://thinkprogress.org/kyrsten-sinema-wins-5d41f3f73c91/
71,Top,Throwawaydude01928,2019-01-17 18:42:57,thehill.com,0,ah0y1k,False,2119,4,57921,House votes 362-53 to disapprove Trump lifting of sanctions on Russian companies,0.9,https://thehill.com/policy/national-security/425864-house-votes-262-53-to-disapprove-trump-lifting-of-sanctions-on
72,Top,guardiandevil,2019-02-19 16:37:06,oversight.house.gov,7,ascazi,False,3013,16,57860,Multiple Whistleblowers Raise Concerns about White House Transferring Sensitive U.S. Nuclear Technology to Saudi Arabia,0.88,https://oversight.house.gov/news/press-releases/multiple-whistleblowers-raise-grave-concerns-with-white-house-efforts-to
73,Top,,2018-11-04 19:22:04,thehill.com,1,9u67ke,False,1515,9,57666,Author Stephen King Tells Iowans to Vote Out Steve King: ‘I’m Tired of Being Confused With This Racist Dumbbell’,0.82,https://thehill.com/homenews/house/414785-author-stephen-king-tells-iowans-to-vote-out-steve-king-im-tired-of-being
74,Top,tank_trap,2019-02-06 14:49:57,time.com,1,anrf0h,False,3970,8,57601,President Trump Used the State of the Union to Call for an End to Investigations. So Did Nixon,0.75,http://time.com/5522285/trump-economy-nixon/
75,Top,melinda2020,2019-01-18 12:15:56,huffingtonpost.com,0,ah9vjw,False,6948,7,57587,'Resign Or Be Impeached': Twitter Erupts Over Bombshell Trump Obstruction Report,0.8,https://www.huffingtonpost.com/entry/trump-obstruction-report-twitter-reaction_us_5c41826de4b0a8dbe16fb1f4
76,Top,ideogon,2018-08-24 18:18:22,commondreams.org,2,99ztji,False,5443,10,57489,"To Force Billionaires Off Welfare, Sanders Tax Would Make Corporations Fund 100% of Public Assistance Their Low-Paid Workers Receive",0.87,https://www.commondreams.org/news/2018/08/24/force-billionaires-welfare-sanders-tax-would-make-corporations-fund-100-public
77,Top,,2018-12-18 21:52:51,buzzfeednews.com,0,a7fp0w,False,3637,8,57436,All 83 of the Ethics Complaints Against Justice Brett Kavanaugh Were Dismissed Because He's on the Supreme Court Now,0.8,https://www.buzzfeednews.com/article/zoetillman/brett-kavanaugh-ethics-complaints-dismissed-supreme-court
78,Top,trippypolitics,2019-01-29 19:01:34,esquire.com,1,al3d09,False,4436,4,57318,"Look at This Embarrassing F*cking Moron: The president tweets, for the umpteenth time, that climate change is not real because it's cold outside.",0.78,https://www.esquire.com/news-politics/a26077427/trump-tweet-midwest-cold-global-warming/
79,Top,whoiswillo,2018-10-09 20:58:42,star-telegram.com,0,9mt06k,False,3656,6,57145,"Ted Cruz declines, so challenger Beto O’Rourke gets an hour on national TV by himself",0.87,https://www.star-telegram.com/news/politics-government/article219732670.html
80,Top,hasibulhasanpro,2019-01-18 21:27:06,huffingtonpost.com,1,ahf7wp,False,1616,8,57053,"Pentagon Confirms Climate Change Is A National Security Threat, Contradicting Trump",0.87,https://www.huffingtonpost.com/entry/defense-department-climate-change-national-security-threat_us_5c420386e4b027c3bbc1713f
81,Top,RyanSmith,2019-03-01 20:43:59,news.vice.com,1,aw9hol,False,3279,13,56861,Michael Cohen implicated Trump in at least 11 different felonies,0.8,https://news.vice.com/en_us/article/8xykv4/michael-cohen-implicated-trump-in-at-least-11-different-felonies
82,Top,pipsdontsqueak,2018-06-04 12:40:41,cnbc.com,8,8ogxy9,False,8303,5,56579,Trump: 'I have the absolute right to pardon myself',0.89,http://cnbc.com/id/105239219
83,Top,dantstk,2019-04-08 18:47:54,axios.com,1,baxiov,False,3724,6,56554,House Judiciary Committee calls on Robert Mueller to testify,0.91,https://www.axios.com/house-judiciary-committee-robert-mueller-testify-610c51f8-592f-4f51-badc-dc1611f22090.html
84,Top,Creasy007,2018-09-07 17:00:08,thehill.com,2,9dw9rm,False,6844,5,56506,Obama: How Hard Can It Be to Say 'Nazis Are Bad'?,0.84,http://thehill.com/homenews/news/405576-obama-how-hard-can-it-be-to-say-nazis-are-bad
85,Top,Bloodbath-McGrath,2018-12-18 15:54:48,washingtonpost.com,0,a7c958,False,4286,9,56455,Trump agrees to shut down his charity amid allegations he used it for personal and political benefit,0.87,https://www.washingtonpost.com/news/politics/wp/2018/12/18/trump-agrees-to-shut-down-his-charity-amid-allegations-he-used-it-for-personal-and-political-benefit/
86,Top,Nomandate,2018-07-27 18:44:57,theweek.com,1,92f6q8,False,3350,1,56423,Donald Trump Jr says Obama never broke 2 percent GDP growth. He did. 15 times.,0.84,http://theweek.com/speedreads/787256/donald-trump-jr-says-obama-never-broke-2-percent-gdp-growth-did-15-times
87,Top,bluestblue,2019-03-12 18:44:27,vox.com,2,b0be47,False,2434,3,56371,"Trump said he wouldn’t cut Medicaid, Social Security, and Medicare. His 2020 budget cuts all 3.",0.85,https://www.vox.com/policy-and-politics/2019/3/12/18260271/trump-medicaid-social-security-medicare-budget-cuts
88,Top,hopopo,2019-02-21 15:45:08,northjersey.com,0,at4ktf,False,4511,6,56306,Bill would keep Trump off 2020 NJ ballot unless he releases his tax returns,0.78,https://www.northjersey.com/story/news/new-jersey/2019/02/21/nj-bill-trump-2020-ballot-releases-tax-returns/2926652002/
89,Top,slimjim7777,2019-01-25 21:25:32,mynbc15.com,0,ajttzi,False,1981,4,56244,Sen. Doug Jones introduces Back Pay Fairness Act to reimburse fed workers with interest,0.89,https://mynbc15.com/news/local/sen-doug-jones-introduces-back-pay-fairness-act-to-reimburse-fed-workers-with-interest
