,Type,author,date,domain,gilded,id,nsfw,num_comments,num_crossposts,score,title,upvote_ratio,url
267,Top,fantasykingdom,2019-01-19 18:06:04,businessinsider.com,0,ahogcn,False,3018,2,46768,"Most Americans would rather spend the $5 billion Trump is demanding for the border wall on infrastructure, education, or healthcare",0.79,https://www.businessinsider.com/government-shutdown-poll-ocasio-cortez-ideas-for-trump-border-wall-money-2018-12
268,Top,Tech-no,2018-11-17 15:45:56,nytimes.com,0,9xxbez,False,2481,5,46730,"Nearly 3,000 Votes Disappeared From Florida’s Recount. That’s Not Supposed to Happen.",0.86,https://www.nytimes.com/2018/11/16/us/voting-machines-florida.html?
269,Top,ppldontread,2018-10-19 17:20:34,salon.com,2,9plwns,False,2941,5,46721,"Analysis: Brian Kemp has purged over 300,000 voters from Georgia rolls",0.87,https://www.salon.com/2018/10/19/analysis-brian-kemp-has-purged-over-300000-voters-from-georgia-rolls/
270,Top,throwaway5272,2019-01-07 15:37:04,nymag.com,1,adishp,False,5535,9,46645,Trump Literally Did Not Understand What a Shutdown Would Do,0.8,http://nymag.com/intelligencer/2019/01/trump-shutdown-government-did-not-know.html
271,Top,roku44,2018-12-06 13:33:57,commondreams.org,2,a3nxpz,False,2044,7,46647,"After Years of Fearmongering Mythical Threat of Voter Fraud, GOP 'Silence Now Deafening' as Real Election Fraud Exposed in North Carolina",0.88,https://www.commondreams.org/news/2018/12/06/after-years-fearmongering-mythical-threat-voter-fraud-gop-silence-now-deafening-real
272,Top,trippypolitics,2019-01-22 20:30:09,13newsnow.com,1,air34v,False,2106,6,46599,Sen. Warner introduced bill to end future government shutdowns: Senator Warner's Stop STUPIDITY (Shutdowns Transferring Unnecessary Pain and Inflicting Damage In The Coming Years) Act would fund the government except for the legislative branch and the Executive Office of the President,0.87,https://www.13newsnow.com/article/news/politics/sen-warner-introduced-bill-to-end-future-government-shutdowns/291-6398cc5d-b67a-4263-a48a-a530fe76fda6
273,Top,lobsterbash,2019-03-12 15:14:20,washingtonpost.com,0,b08w9m,False,2008,5,46600,Trump vowed to eliminate the debt in 8 years. He’s on track to leave it at least 50 percent higher.,0.86,https://www.washingtonpost.com/business/2019/03/12/trump-vowed-eliminate-debt-years-hes-track-leave-it-least-percent-higher/?noredirect=on&utm_term=.3bdb46f12f82
274,Top,MaryADraper,2018-11-13 14:21:56,cnn.com,0,9wpgca,False,3694,3,46501,CNN sues President Trump and top White House aides for barring Jim Acosta,0.84,https://www.cnn.com/2018/11/13/media/cnn-sues-trump/index.html
275,Top,gobananaboating,2018-10-11 21:18:07,thehill.com,1,9ne1ql,False,4574,6,46420,Clinton fires back at Trump: 'You asked Russia to hack me on national television',0.75,https://thehill.com/blogs/blog-briefing-room/news/411049-clinton-fires-back-at-trump-you-asked-russia-to-hack-me-on
276,Top,TYLER_WAS_ROBBED,2019-03-11 22:35:06,politico.com,0,azzvjj,False,2802,18,46387,Facebook takes down Elizabeth Warren ads calling for breakup of Facebook,0.87,https://www.politico.com/story/2019/03/11/facebook-removes-elizabeth-warren-ads-1216757
277,Top,progress18,2019-04-03 17:25:27,thehill.com,2,b90wku,False,2298,14,46350,New Mexico officially replaces Columbus Day with Indigenous Peoples Day,0.87,https://thehill.com/homenews/state-watch/437176-new-mexico-officially-replaces-columbus-day-with-indigenous-peoples-day
278,Top,PoliticsModeratorBot,2019-01-25 15:42:54,self.politics,1,ajq8wp,False,13612,5,46328,[Megathread] FAA Orders Ground Stops and Delays Flights at Major U.S. Airports Due to Shutdown-Related Air Traffic Controller Shortage,0.9,https://www.reddit.com/r/politics/comments/ajq8wp/megathread_faa_orders_ground_stops_and_delays/
279,Top,MuzzleO,2019-01-23 13:52:35,defensenews.com,0,aizwd7,False,3411,0,46323,US House votes overwhelmingly to bar US exit from NATO,0.9,https://www.defensenews.com/congress/2019/01/23/us-house-votes-overwhelmingly-to-bar-us-exit-from-nato/
280,Top,just__Steve,2018-10-15 01:13:18,vox.com,1,9o87ob,False,3066,4,46316,Donald Trump finally just said it: he doesn’t care if Kavanaugh’s accuser is telling the truth,0.77,https://www.vox.com/2018/10/14/17976620/donald-trump-ford-lesley-stahl-60-minutes-kavanaugh-accuser
281,Top,Ed_Krassenstein,2018-10-25 16:00:31,thinkprogress.org,0,9rblif,False,2847,18,46195,Trump claims ‘I rarely use a cellphone’ in tweet sent from iPhone,0.82,https://thinkprogress.org/donald-trump-twitter-iphone-russia-china-spy-phone-calls-9588431ca568/
282,Top,cogit4se,2018-11-09 22:20:09,newsweek.com,0,9vowol,False,2636,9,46119,"Acting attorney general Matthew Whitaker once said jews, muslims and atheists should not be federal judges",0.85,https://www.newsweek.com/matthew-whitaker-jews-muslim-judges-attorney-general-1210003?utm_source=Public&utm_medium=Feed&utm_campaign=Distribution
283,Top,RationalAnon,2018-12-23 13:16:12,thehill.com,1,a8uknp,False,2448,3,46098,Dem senator: Trump saying he doesn’t know his top ISIS envoy ‘should scare the hell out of every American’,0.82,https://thehill.com/policy/defense/422628-dem-senator-trump-saying-he-doesnt-know-his-top-isis-envoy-should-scare-the
284,Top,AFWxGuy,2019-01-11 16:49:14,cnbc.com,0,aex8yj,False,4375,4,46095,"If the shutdown lasts two more weeks, the cost to the economy will exceed price of Trump's wall",0.86,https://www.cnbc.com/2019/01/11/shutdown-cou-mean-2-billion-less-consumer-spending-a-week-hitting-these-retailers-the-most.html
285,Top,RationalAnon,2018-12-06 15:55:31,lawandcrime.com,1,a3p5cf,False,2259,4,46065,"Trump’s 2020 Campaign Has Funneled Over $1 Million Into His Own Businesses, Report Says",0.87,https://lawandcrime.com/high-profile/trumps-2020-campaign-has-funneled-over-1-million-into-his-own-businesses-report-says/
286,Top,jingooftherex,2018-10-13 14:23:16,nytimes.com,0,9nu3nf,False,2558,6,45995,"Kushner Likely Paid No Federal Income Taxes for Years, Documents Show",0.85,https://www.nytimes.com/2018/10/13/business/jared-kushner-taxes.html
287,Top,TYLER_WAS_ROBBED,2018-12-03 22:45:34,lawandcrime.com,1,a2u3cy,False,2249,3,45910,"Fmr Federal Prosecutor: If I Had a Wiretap and Someone Said What Trump Tweeted I’d Say ‘Wow, We Got Him on Obstruction’",0.85,https://lawandcrime.com/high-profile/fmr-federal-prosecutor-if-i-had-a-wiretap-and-someone-said-what-trump-tweeted-id-say-wow-we-got-him-on-obstruction/
288,Top,EnoughPM2020,2019-04-20 18:44:19,newsweek.com,1,bffkqg,False,3561,8,45887,"Rep. Ilhan Omar: Legalize marijuana everywhere, expunge records of those jailed for pot offenses",0.84,https://www.newsweek.com/rep-ilhan-omar-legalize-marijuana-nationwide-expunge-criminal-records-those-1402110
289,Top,dantstk,2019-04-04 17:55:59,axios.com,1,b9g0zu,False,3430,6,45857,Senate Republicans block resolution to release Mueller report for 5th time,0.89,https://www.axios.com/mueller-report-republicans-rand-paul-block-release-60e8ac29-d427-40e1-b792-913b7a378d3e.html
290,Top,stone_dog,2018-08-28 09:37:15,independent.co.uk,1,9axhcl,False,5065,8,45846,Trump news: President claims Google is rigging search results to make him look bad,0.86,https://www.independent.co.uk/life-style/gadgets-and-tech/news/trump-news-google-search-results-twitter-rigged-us-president-a8510736.html%3Famp&ved=2ahUKEwjI-PaMuI_dAhUl8IMKHdXgB-8QFjABegQIBRAB&usg=AOvVaw2a04eEdnQxnN7tuNZFAJD0&ampcf=1
291,Top,Creasy007,2019-01-31 21:32:50,thehill.com,1,aluigs,False,1413,4,45754,Dems Call For Revoking Kushner's Security Clearance,0.85,https://thehill.com/homenews/house/427931-dems-call-for-revoking-kushners-security-clearance
292,Top,CavePrisoner,2019-02-22 13:09:10,businessinsider.com,1,athej3,False,3599,15,45699,25 million tonnes of US soybeans will go unsold this year as a direct consequence of the trade war with China,0.84,https://www.businessinsider.com/trump-china-trade-war-25-million-tonnes-of-us-soybeans-to-go-unsold-2019-2
293,Top,thewateroflife,2019-02-14 12:30:08,cbsnews.com,3,aqj8yr,False,3353,8,45642,McCabe says he ordered the obstruction of justice probe of President Trump,0.85,https://www.cbsnews.com/news/andrew-mccabe-says-he-ordered-the-obstruction-of-justice-case-of-president-trump-60-minutes/
294,Top,deraser,2018-08-07 14:40:26,arstechnica.com,0,95c7br,False,1836,5,45593,"Ajit Pai admits FCC lied about “DDoS,” blames it on Obama administration",0.92,https://arstechnica.com/information-technology/2018/08/ajit-pai-admits-fcc-lied-about-ddos-blames-it-on-obama-administration/
295,Top,,2018-07-24 15:59:58,thehill.com,1,91inc3,False,7046,9,45499,Trump: I'm concerned Russia may interfere in election to help Democrats,0.89,http://thehill.com/homenews/administration/398566-trump-im-concerned-russia-may-interfere-in-election-to-help-democrats
296,Top,Donalds_neck_fat,2019-05-22 18:05:04,theroot.com,1,brs0sc,False,2122,5,45471,Trump Spent More Than Three Times the Cost of Robert Mueller's Russia Investigation Playing Golf at His Own Resorts,0.89,https://www.theroot.com/trump-spent-more-than-three-times-the-cost-of-robert-mu-1834950100
297,Top,PoliticsModeratorBot,2018-12-05 01:57:44,self.politics,2,a37jjv,False,9015,5,45456,"Megathread: Special counsel calls ex-National Security Adviser Michael Flynn's cooperation 'substantial,' recommends no jail time",0.9,https://www.reddit.com/r/politics/comments/a37jjv/megathread_special_counsel_calls_exnational/
298,Top,FatassShrugged,2019-03-07 17:14:37,rollcall.com,1,ayf0cb,False,2488,1,45435,Pelosi OK with investigating Trump children: ‘They are advisers to the president’,0.84,https://www.rollcall.com/news/congress/nancy-pelosi-signs-off-on-democrats-investigating-trump-children-they-are-advisers-to-the-president
299,Top,SplodeyDope,2019-01-08 12:00:42,thinkprogress.org,3,adtjmn,False,4220,2,45403,"Networks agree to carry Trump’s speech about nonexistent ‘crisis’ at U.S.-Mexico border - A 2014 Obama address on immigration was called too “overtly political"" to air by many of these same networks.",0.8,https://thinkprogress.org/donald-trump-border-wall-national-emergency-immigration-address-nation-mexico-twitter-909cd43a66a8/
300,Top,Bloodbath-McGrath,2018-06-14 14:39:01,washingtonpost.com,2,8r2cwx,False,4054,6,45375,"New York files suit against Trump, alleging his charity engaged in ‘illegal conduct’",0.86,https://www.washingtonpost.com/news/politics/wp/2018/06/14/new-york-files-suit-against-trump-alleging-his-charity-engaged-in-illegal-conduct/
301,Top,SlavojVivec,2019-04-09 11:54:25,propublica.org,1,bb70d5,False,3471,8,45343,Congress Is About to Ban the Government From Offering Free Online Tax Filing. Thank TurboTax.,0.94,https://www.propublica.org/article/congress-is-about-to-ban-the-government-from-offering-free-online-tax-filing-thank-turbotax
302,Top,seanDL_,2019-02-04 11:15:27,reuters.com,0,an0pj6,False,2376,11,45331,"Senator Sanders to ask why drug, once free, now costs $375k",0.84,https://www.reuters.com/article/us-usa-healthcare-catalyst/senator-sanders-to-ask-why-drug-once-free-now-costs-375k-idUSKCN1PT0ZJ?utm_source=applenews
303,Top,Sepheus,2019-03-05 16:33:55,lieu.house.gov,0,axn33m,False,1053,3,45285,Reps Lieu and Beyer call for criminal investigation into Jared Kushner's security clearance,0.87,https://lieu.house.gov/media-center/press-releases/reps-lieu-and-beyer-call-criminal-investigation-jared-kushner-security
304,Top,TrumpIsALilliputian,2018-06-27 21:17:18,washingtonpost.com,0,8udgfo,False,4592,6,45275,Puerto Rico introduces bill to become US state,0.9,https://www.washingtonpost.com/politics/congress/puerto-rico-introduces-bill-to-become-us-state/2018/06/27/ac175494-7a49-11e8-ac4e-421ef7165923_story.html
305,Top,PoliticsModeratorBot,2019-04-19 14:03:57,self.politics,2,bezgqg,False,15487,2,45244,Megathread: House Democrats Issue Subpoena for Unredacted Mueller Report,0.88,https://www.reddit.com/r/politics/comments/bezgqg/megathread_house_democrats_issue_subpoena_for/
306,Top,ONE-OF-THREE,2018-06-10 01:34:44,cnn.com,0,8pxl1g,False,2399,2,45196,"McCain to allies: 'Americans stand with you, even if our president doesn't'",0.82,https://www.cnn.com/2018/06/09/politics/mccain-statement-trade/index.html
307,Top,relevantlife,2018-12-28 00:56:02,commondreams.org,1,aa58z5,False,2604,4,45187,"Survey shows most Americans agree with Ocasio-Cortez: $5 billion should be spent on healthcare or education, not Trump's border wall.",0.76,https://www.commondreams.org/news/2018/12/27/survey-shows-most-americans-agree-ocasio-cortez-5-billion-should-be-spent-healthcare?
308,Top,PoliticsModeratorBot,2019-02-05 03:03:35,self.politics,2,an9rnt,False,9507,2,45160,Megathread: Federal prosecutors subpoena Trump’s inaugural committee,0.82,https://www.reddit.com/r/politics/comments/an9rnt/megathread_federal_prosecutors_subpoena_trumps/
309,Top,Jaf207,2018-11-21 00:16:24,sltrib.com,1,9yy099,False,2232,1,45151,It’s over. Democrat Ben McAdams ousts Republican Rep Mia Love by 694 votes,0.84,https://www.sltrib.com/news/politics/2018/11/20/its-over-democrat-ben/
310,Top,readet,2018-09-21 19:19:18,commondreams.org,1,9ht63c,False,3450,7,45117,"400,000 Americans in 900 Cities Ready to Take to Streets If President Trump Fires Rosenstein After NYT Bombshell",0.81,https://www.commondreams.org/news/2018/09/21/400000-americans-900-cities-ready-take-streets-if-president-trump-fires-rosenstein
311,Top,thiman,2018-11-14 15:32:12,cnn.com,0,9x132h,False,2354,10,45072,Donald Trump has sent a total of 0 tweets on the caravan since the election,0.87,https://www.cnn.com/2018/11/14/politics/donald-trump-caravan/index.html?utm_source=twCNN&utm_medium=social&utm_content=2018-11-14T15%3A30%3A03&utm_term=image
312,Top,mixplate,2018-09-29 21:31:31,nymag.com,6,9k0qk7,False,3593,7,45075,White House Is Controlling Who FBI Interviews in Kavanaugh Investigation,0.86,http://nymag.com/daily/intelligencer/2018/09/kavanaugh-investigation-limited-by-white-house-report.html
313,Top,AFWxGuy,2019-01-28 14:59:18,thehill.com,0,ako6q2,False,3798,4,45013,"Ocasio-Cortez: If Trump was gone tomorrow, it wouldn't change 'systemic injustices'",0.78,https://thehill.com/homenews/house/427227-ocasio-cortez-trump-could-be-gone-tomorrow-and-it-wouldnt-change-systemic
314,Top,OfficeZombie88,2018-12-10 03:40:47,edition.cnn.com,0,a4rzij,False,3342,7,44969,Comey calls on Americans to 'use every breath we have' to oust Trump in 2020,0.78,https://edition.cnn.com/2018/12/09/politics/james-comey-donald-trump-2020/index.html
315,Top,RepresentativeZombie,2018-08-17 00:10:42,cnbc.com,1,97xlbe,False,3229,2,44927,Pentagon says it's postponing Trump's military parade,0.89,https://www.cnbc.com/2018/08/17/pentagon-says-its-postponing-trumps-military-parade.html
316,Top,narbz,2018-10-29 17:11:40,vanityfair.com,5,9sf1bo,False,3636,9,44860,Report: Trump Clocks in About Three Hours of Work on a Good Day,0.81,https://www.vanityfair.com/news/2018/10/trump-schedule-executive-time
317,Top,pipsdontsqueak,2018-09-13 12:41:40,cnbc.com,1,9fhmra,False,5733,5,44832,"Trump claims 3,000 people did not die in Puerto Rico hurricanes",0.88,http://cnbc.com/id/105441842
318,Top,TrumpSharted,2018-06-19 15:34:41,cnn.com,0,8s9sj8,False,4795,3,44805,"George Takei: At least during my internment, I was not taken from my parents",0.83,https://www.cnn.com/2018/06/19/politics/george-takei-family-separation-op-ed/index.html
319,Top,owen00600,2018-11-08 21:31:18,commondreams.org,0,9ve63c,False,2524,2,44723,"Huckabee Sanders Should Resign, Critics Say, After 'Orwellian' Distribution of Doctored Video",0.86,https://www.commondreams.org/news/2018/11/08/huckabee-sanders-should-resign-critics-say-after-orwellian-distribution-doctored
320,Top,PoliticsModeratorBot,2019-01-23 20:16:49,self.politics,1,aj3yq0,False,17190,4,44717,Megathread: Speaker Pelosi tells President Trump the House won't authorize State of the Union address in the chamber 'until government has opened',0.83,https://www.reddit.com/r/politics/comments/aj3yq0/megathread_speaker_pelosi_tells_president_trump/
321,Top,bbukbots,2019-02-18 15:14:35,speaker.gov,4,ary64k,False,3285,5,44658,Trump Violates Constitution and Undermines America’s Safety with Emergency Declaration,0.76,https://www.speaker.gov/newsroom/21519-3/
322,Top,jaymar01,2018-08-16 21:58:46,businessinsider.com,1,97wlhj,False,3200,8,44644,'You have embarrassed us in the eyes of our children': Navy SEAL who oversaw the Osama bin Laden raid rebukes Trump in stunning opinion column,0.86,https://www.businessinsider.com/navy-seal-william-mcraven-trump-security-clearance-2018-8
323,Top,mar_kelp,2018-07-05 22:08:07,apnews.com,3,8wem9n,False,5029,7,44640,AP NewsBreak: US Army quietly discharging immigrant recruits,0.86,https://apnews.com/38334c4d061e493fb108bd975b5a1a5d
324,Top,bluestblue,2018-11-28 17:03:15,vox.com,0,a1829s,False,2476,5,44621,"Ivanka Trump claims her father didn’t authorize “lethal force” at border. He did, on tape.",0.85,https://www.vox.com/policy-and-politics/2018/11/28/18116126/ivanka-trump-abc-lethal-force-authorization
325,Top,slingtarp,2018-11-11 02:01:35,washingtonpost.com,1,9w02u3,False,1397,3,44602,"Democrat Harley Rouda wins California U.S. House seat, defeats 15-term Republican Rep. Dana Rohrabacher",0.87,https://www.washingtonpost.com/politics/democrat-harley-rouda-wins-california-us-house-seat-defeats-15-term-republican-rep-dana-rohrabacher/2018/11/10/94e82824-e552-11e8-ba30-a7ded04d8fac_story.html?noredirect=on&utm_term=.6969e09c473f
326,Top,trippypolitics,2019-02-04 20:06:48,news.vice.com,2,an5oaz,False,2049,6,44555,Don Jr. and Jared Kushner’s congressional testimonies are finally going to Mueller,0.84,https://news.vice.com/en_us/article/vbwv74/don-jr-and-jared-kushners-congressional-testimonies-are-finally-going-to-mueller
327,Top,PoliticsModeratorBot,2019-01-25 19:50:18,self.politics,1,ajsubi,False,12936,1,44550,Megathread: President Trump announces a deal to temporarily reopen the government for three weeks,0.88,https://www.reddit.com/r/politics/comments/ajsubi/megathread_president_trump_announces_a_deal_to/
328,Top,mikewall,2018-12-21 11:19:53,washingtonpost.com,0,a891of,False,2430,9,44535,"President Trump has made 7,546 false or misleading claims over 700 days",0.8,https://www.washingtonpost.com/politics/2018/12/21/president-trump-has-made-false-or-misleading-claims-over-days/
329,Top,mvanigan,2019-03-13 16:41:01,cnbc.com,1,b0o4hc,False,2777,3,44518,Paul Manafort indicted by NY prosecutors after federal sentencing,0.88,https://www.cnbc.com/2019/03/13/paul-manafort-indicted-by-ny-prosecutors-after-federal-sentencing.html
330,Top,segvcore,2019-01-04 18:40:11,cnbc.com,1,acl4ra,False,8887,6,44515,"Trump threatened to keep the government closed for 'months or even years,' Schumer says",0.88,https://www.cnbc.com/2019/01/04/trump-threatened-to-keep-the-government-closed-for-months-or-even-years-schumer-says.html
331,Top,roku44,2019-02-22 06:57:05,newsweek.com,2,ateddy,False,3285,20,44488,"Jeffery Epstein Sex Trafficked Underage Girls And Trump’s Secretary Of Labor Illegally Covered It Up, Federal Judge Says",0.88,https://www.newsweek.com/jeffrey-epstein-alexander-acosta-trump-sex-trafficking-underage-minor-1339974
332,Top,,2018-06-20 12:31:42,theweek.com,3,8shxax,False,6571,0,44420,Donald Trump is indisputably the worst president in American history,0.72,http://theweek.com/articles/779929/donald-trump-indisputably-worst-president-american-history
333,Top,njmaverick,2019-01-24 16:09:07,salon.com,0,ajdwtm,False,3498,5,44412,Lindsey Graham renews probe into Hillary's emails; Democrats burst out laughing,0.83,https://www.salon.com/2019/01/23/lindsey-graham-renews-probe-into-hillarys-emails-democrats-burst-out-laughing/
334,Top,N0tAG00dUserName,2019-01-07 20:15:12,vice.com,1,adlop8,False,3266,3,44399,The Shutdown Is Mitch McConnell's Fault,0.82,https://www.vice.com/en_us/article/a3mmaz/the-shutdown-is-mitch-mcconnells-fault
335,Top,mvanigan,2019-03-04 22:00:56,cnbc.com,1,axd0ql,False,1712,3,44366,Special counsel Robert Mueller notifies judge that Trump friend Roger Stone posted Instagram image that could violate gag order,0.86,https://www.cnbc.com/2019/03/04/robert-mueller-notifies-judge-that-roger-stone-shared-instagram-image.html?__source=twitter%7Cmain
336,Top,nowhathappenedwas,2018-05-31 21:36:15,washingtonpost.com,0,8nmbo7,False,2212,5,44337,Trump has officially put more tariffs on U.S. allies than on China,0.89,https://www.washingtonpost.com/news/wonk/wp/2018/05/31/trump-has-officially-put-more-tariffs-on-u-s-allies-than-on-china/?noredirect=on&utm_term=.ec606ae284ad
337,Top,emitremmus27,2018-06-13 20:20:59,newsweek.com,0,8qvozh,False,2649,1,44314,Fox News Mocked For Praising Trump's Kim Jong Un Meeting After Slamming Obama's Willingness To Talk With 'Dictators',0.82,http://www.newsweek.com/fox-news-trump-kim-obama-975441
338,Top,porchmunkeyforlife,2019-01-23 02:53:21,cbsnews.com,1,aiv23v,False,3798,3,44289,Alexandria Ocasio-Cortez wins seat on powerful House Oversight committee,0.78,https://www.cbsnews.com/news/alexandria-ocasio-cortez-wins-seat-on-powerful-house-oversight-committee/
339,Top,PoliticsModeratorBot,2018-12-07 22:10:18,self.politics,2,a44oxl,False,11074,0,44269,Megathread: Federal prosecutors recommend ‘substantial’ prison term for former Trump lawyer Michael Cohen,0.87,https://www.reddit.com/r/politics/comments/a44oxl/megathread_federal_prosecutors_recommend/
340,Top,supercubbiefan,2018-12-09 18:01:20,washingtonpost.com,0,a4n0uw,False,2081,7,44236,Senate Republicans are responsible for the most unethical and incompetent administration ever,0.79,https://www.washingtonpost.com/opinions/2018/12/09/senate-republicans-are-responsible-most-unethical-incompetent-administration-ever/?utm_term=.a896e3a0a658
341,Top,kalofel,2018-11-10 01:15:53,itk.thehill.com,0,9vq83w,False,2800,6,44233,Mail-in ballots found sitting in Miami distribution center,0.9,https://itk.thehill.com/homenews/campaign/416038-dozens-of-mail-in-ballots-sitting-in-miami-distribution-center-report
342,Top,the_mikepence,2018-08-06 20:44:05,talkingpointsmemo.com,2,9550gf,False,3292,4,44213,Rick Gates: I Committed Crimes With Paul Manafort,0.9,https://talkingpointsmemo.com/muckraker/rick-gates-i-committed-crimes-with-paul-manafort
343,Top,progress18,2018-10-01 12:15:46,talkingpointsmemo.com,0,9kfssy,False,4261,5,44204,Outrage Grows As Omissions From Kavanaugh Probe Become Apparent,0.84,https://talkingpointsmemo.com/news/outrage-grows-as-omissions-from-kavanaugh-probe-become-apparent
344,Top,B7dust11,2018-10-17 14:43:52,vtdigger.org,0,9oz9mr,False,1833,1,44191,Vermont hits record 92.5 percent voter registration ahead of election,0.92,https://vtdigger.org/2018/10/16/vermont-hits-record-92-5-percent-voter-registration-ahead-election/
345,Top,theearthgarden,2018-08-01 20:41:48,abcnews.go.com,3,93ssv1,False,3663,5,44151,Special counsel Mueller wants to ask Trump about obstruction of justice,0.88,https://abcnews.go.com/US/special-counsel-mueller-president-obstruction-justice-sources/story?id=56973384&cid=social_twitter_abcn
346,Top,wonderingsocrates,2018-11-28 00:14:57,washingtonpost.com,1,a10qd9,False,2727,4,44139,US sued for $60 million after infant in detention later died,0.85,https://www.washingtonpost.com/national/us-sued-for-60-million-after-infant-in-detention-later-died/2018/11/27/fafe7e0e-f2a1-11e8-99c2-cfca6fcf610c_story.html?noredirect=on
347,Top,kaffmoo,2019-03-05 00:48:04,businessinsider.com,0,axeu11,False,4136,3,44112,More than a third of millennials share Alexandria Ocasio-Cortez's worry about having kids while the threat of climate change looms,0.76,https://www.businessinsider.com/millennials-americans-worry-about-kids-children-climate-change-poll-2019-3
348,Top,mvea,2018-12-28 11:32:53,vox.com,0,aa9kn3,False,1875,1,44061,Senators are getting paid during the government shutdown. Many low-wage contractors aren’t.,0.89,https://www.vox.com/policy-and-politics/2018/12/27/18157684/government-shutdown-contractors-janitors
349,Top,TYLER_WAS_ROBBED,2019-01-04 20:48:36,cnn.com,1,acmh81,False,2764,3,44036,Mueller grand jury gets 6 month extension,0.86,https://www.cnn.com/2019/01/04/politics/mueller-grand-jury/index.html
350,Top,slakmehl,2019-05-19 16:04:19,nytimes.com,8,bqil5l,False,2166,6,44031,Deutsche Bank Staff Saw Suspicious Activity in Trump and Kushner Accounts,0.86,https://www.nytimes.com/2019/05/19/business/deutsche-bank-trump-kushner.html
351,Top,OrmDraebogPlundra,2019-02-25 20:16:25,finance.yahoo.com,1,auprgf,False,4129,6,44013,"Amazon will pay $0 in taxes on $11,200,000,000 in profit for 2018",0.78,https://finance.yahoo.com/news/amazon-taxes-zero-180337770.html?fbclid=IwAR3Ck8tSGHu-3OZukcIqcizc1buEvN0_P1Texhl6bzfJLsmk6HmGEC0yjQA
352,Top,rollwave21,2019-04-30 23:08:27,washingtonpost.com,15,bja2t9,False,3244,8,43960,"Mueller told the attorney general that the depiction of his findings failed to capture ‘context, nature, and substance’ of probe",0.9,https://www.washingtonpost.com/news/politics/wp/2019/04/30/mueller-told-the-attorney-general-that-the-depiction-of-his-findings-failed-to-capture-context-nature-and-substance-of-probe/
353,Top,a_fuller,2018-12-02 21:11:14,axios.com,1,a2hc7y,False,2119,5,43900,Democrats won the House with the largest midterms margin of all time,0.81,https://www.axios.com/2018-midterm-elections-democrats-won-house-biggest-margin-a56a1049-8823-4667-8d81-2c67ef3f36f4.html
354,Top,trippypolitics,2019-02-25 23:36:04,thedailybeast.com,4,aus25i,False,2079,3,43861,"Paul Manafort Gave Konstantin Kilimnik 75 Pages of Polling Data, Docs Suggest",0.87,https://www.thedailybeast.com/paul-manafort-gave-konstantin-kilimnik-75-pages-of-polling-data-docs-suggest
355,Top,ClintGreasewood,2018-06-21 22:20:11,lawandcrime.com,2,8sw4ad,False,1909,4,43834,Man Arrested for Possessing Child Pornography Hired to Manage Children at Migrant Detention Center,0.91,https://lawandcrime.com/immigration/man-arrested-for-possessing-child-pornography-hired-to-manage-children-at-migrant-detention-center/
