,Type,author,date,domain,gilded,id,nsfw,num_comments,num_crossposts,score,title,upvote_ratio,url
535,Top,SamDumberg,2019-01-15 16:23:00,nbcnews.com,0,aga74e,False,1182,1,39746,Shutdown has kept Trump off golf course for longest stretch of his presidency,0.88,https://www.nbcnews.com/card/shutdown-has-kept-trump-golf-course-longest-stretch-his-presidency-n958506
536,Top,PoliticsModeratorBot,2019-05-01 00:32:00,self.politics,5,bjaxml,False,7126,0,39749,[Megathread] Mueller Complained That Barr’s Letter Did Not Capture ‘Context’ of Trump Probe,0.87,https://www.reddit.com/r/politics/comments/bjaxml/megathread_mueller_complained_that_barrs_letter/
537,Top,jlew24asu,2018-10-03 17:29:55,bloomberg.com,2,9l3aue,False,2340,5,39709,"FBI Lacks White House Approval to Talk to Kavanaugh and Ford, Sources Say",0.87,https://www.bloomberg.com/news/articles/2018-10-03/fbi-said-to-lack-white-house-approval-to-talk-to-kavanaugh-ford
538,Top,thesesforty-three,2019-05-23 10:30:49,salon.com,1,bs19s0,False,2220,7,39698,"CEO of small Florida bank loaned Trump millions in 2018, then got Federal Reserve post",0.9,https://www.salon.com/2019/05/23/ceo-of-small-florida-bank-loaned-trump-millions-in-2018-then-got-federal-reserve-post/
539,Top,Ice_Burn,2018-12-01 13:45:31,thehill.com,2,a234jn,False,1177,8,39671,CIA finds Saudi crown prince sent at least 11 messages to adviser who oversaw Khashoggi killing around time of his death,0.93,https://thehill.com/policy/international/middle-east-north-africa/419242-cia-finds-saudi-crown-prince-sent-at-least-11
540,Top,aggie_ftfy,2019-05-23 14:02:10,justice.gov,2,bs3bhj,False,1809,8,39637,Bank CEO Stephen M. Calk Charged With Corruptly Soliciting A Presidential Administration Position In Exchange For Approving $16 Million In Loans,0.94,https://www.justice.gov/usao-sdny/pr/bank-ceo-stephen-m-calk-charged-corruptly-soliciting-presidential-administration
541,Top,,2018-10-04 20:37:34,theweek.com,1,9lfo4n,False,2517,3,39609,Former Supreme Court Justice John Paul Stevens says Kavanaugh's performance during hearings was disqualifying,0.83,http://theweek.com/speedreads/800007/former-supreme-court-justice-john-paul-stevens-says-kavanaughs-performance-during-hearings-disqualifying
542,Top,vfdfnfgmfvsege,2018-11-20 21:28:42,washingtonpost.com,2,9ywk7y,False,1222,4,39605,Conservative nonprofit with obscure roots and undisclosed funders paid Matthew Whitaker $1.2 million,0.87,https://www.washingtonpost.com/investigations/conservative-nonprofit-with-obscure-roots-and-undisclosed-funders-paid-matthew-whitaker-12-million/2018/11/20/25ff987e-e9db-11e8-bd89-eecf3b178206_story.html
543,Top,viva_la_vinyl,2019-03-24 11:30:27,npr.org,0,b4vdqy,False,2908,4,39596,Attorney General Barr Faces Bipartisan Pressure To Make Mueller Report Public,0.91,https://www.npr.org/2019/03/23/706088795/attorney-general-barr-faces-bipartisan-pressure-to-make-mueller-report-public
544,Top,BEARlovesCOOKIE,2018-11-16 18:24:12,thehill.com,0,9xoqsf,False,4363,4,39596,Trump privately asking aides if Pence is loyal,0.85,https://thehill.com/homenews/administration/417135-trump-privately-asking-aides-if-pence-is-loyal-report
545,Top,LineNoise,2019-01-17 11:38:32,marketwatch.com,0,agwx2e,False,2415,6,39578,"Ex-Trump lawyer Michael Cohen hired an IT firm to rig early CNBC, Drudge polls",0.87,https://www.marketwatch.com/story/ex-trump-lawyer-michael-cohen-hired-an-it-firm-to-rig-early-cnbc-drudge-polls-2019-01-17
546,Top,sammykleege,2018-10-11 12:55:52,salon.com,3,9n9prd,False,2185,5,39571,Investigative reporter Craig Unger: “Trump has had contacts with the Russian mafia for 35 years”,0.84,https://www.salon.com/2018/10/11/investigative-reporter-craig-unger-trump-has-had-contacts-with-the-russian-mafia-for-35-years/
547,Top,headee,2018-08-25 16:06:17,newsweek.com,2,9a7v2h,False,2708,6,39545,Roger Stone: Mueller Will Soon Indict Donald Trump Jr. For 'Lying to the FBI',0.87,https://www.newsweek.com/roger-stone-mueller-will-indict-donald-trump-jr-1090698
548,Top,Ichigao55,2018-10-15 23:42:25,lawandcrime.com,1,9oi689,False,1991,9,39516,"At Least 90,000 Voters Purged From Nevada Voter Rolls, Voting Rights Group Claims",0.88,https://lawandcrime.com/high-profile/at-least-90000-voters-purged-from-nevada-voter-rolls-voting-rights-group-claims/
549,Top,CoreWrect,2018-10-17 18:20:02,arstechnica.com,0,9p17il,False,1183,3,39505,Up to 9.5 million net neutrality comments were made with stolen identities,0.92,https://arstechnica.com/tech-policy/2018/10/up-to-9-5-million-net-neutrality-comments-were-made-with-stolen-identities/
550,Top,clib,2019-02-18 19:45:08,talkingpointsmemo.com,0,as15lw,False,3565,4,39489,Stone Posted A Picture Of The Federal Judge On His Case With Crosshairs,0.85,https://talkingpointsmemo.com/news/stone-posted-picture-judge-on-his-case-with-crosshairs
551,Top,newsbyweb,2018-08-05 18:30:57,newyorker.com,0,94u0dr,False,2815,9,39484,The Day Trump Told Us There Was Attempted Collusion with Russia,0.86,https://www.newyorker.com/news-desk/swamp-chronicles/the-day-trump-told-us-there-was-attempted-collusion-with-russia
552,Top,emitremmus26,2018-07-06 13:56:04,newsweek.com,0,8wk9gx,False,4750,6,39451,"Donald Trump Mocked Both John McCain, Who Is Dying, and George H.W. Bush, Who Just Lost His Wife, At Montana Rally",0.85,http://www.newsweek.com/donald-trump-mccain-bush-dying-1010966
553,Top,PoliticsModeratorBot,2018-08-21 18:23:46,self.politics,2,995mww,False,10989,2,39412,Megathread: Trump's former lawyer Michael Cohen reaches tentative plea deal with federal prosecutors,0.91,https://www.reddit.com/r/politics/comments/995mww/megathread_trumps_former_lawyer_michael_cohen/
554,Top,StevenSanders90210,2019-01-03 11:57:29,axios.com,1,ac51zl,False,4598,5,39341,Pelosi breaks with Justice: Trump can be indicted,0.79,https://www.axios.com/nancy-pelosi-speaker-of-the-house-speech-3fc7ccca-ff47-4fe9-bf2f-a3c4d05c30c2.html
555,Top,ILoveLamp9,2018-08-26 09:01:12,edition.cnn.com,0,9ae9j0,False,3009,1,39321,McCain didn't want Trump at funeral service,0.86,https://edition.cnn.com/videos/politics/2018/08/26/john-mccain-trump-funeral-plans-sot-vpx.cnn
556,Top,sigseved,2019-01-11 11:33:48,motherjones.com,2,aeuj1b,False,2348,9,39294,Documents Show NRA and Republican Candidates Coordinated Ads in Key Senate Races,0.84,https://www.motherjones.com/politics/2019/01/nra-republicans-campaign-ads-senate-josh-hawley/
557,Top,PoliticsModeratorBot,2019-05-06 22:25:41,self.politics,0,blim6m,False,15342,2,39281,Megathread: Treasury denies Democrats’ request for Trump tax returns,0.88,https://www.reddit.com/r/politics/comments/blim6m/megathread_treasury_denies_democrats_request_for/
558,Top,Qu1nlan,2018-06-07 14:31:36,lgbtqnation.com,0,8parkh,False,2949,2,39245,A Republican who filmed herself harassing a trans woman lost her election. By a lot.,0.87,https://www.lgbtqnation.com/2018/06/republican-filmed-harassing-trans-woman-lost-election-lot/
559,Top,roku44,2019-01-29 23:00:20,commondreams.org,1,al5ync,False,2268,8,39240,'Greed Has No Limit for GOP': McConnell Estate Tax Repeal Would Hand Tens of Billions to Walton and Koch Families.,0.85,https://www.commondreams.org/news/2019/01/29/greed-has-no-limit-gop-mcconnell-estate-tax-repeal-would-hand-tens-billions-walton
560,Top,heavyballoon,2018-11-09 01:15:40,apnews.com,0,9vg03z,False,2264,4,39228,Expert: Acosta video distributed by White House was doctored,0.84,https://apnews.com/c575bd1cc3b1456cb3057ef670c7fe2a
561,Top,trumpsuxd,2018-12-16 18:36:51,thinkprogress.org,0,a6rivc,False,3157,17,39223,Trump complains that negative coverage of him ‘can’t be legal’ and ‘should be tested in courts’,0.84,https://thinkprogress.org/donald-trump-media-twitter-nbc-saturday-night-live-libel-laws-tweet-white-house-d45acbc7fc12/
562,Top,doogie92,2018-10-08 16:41:20,latimes.com,0,9mgifi,False,1702,3,39216,"Mike Pence's NFL walkout cost taxpayers $325,000 and was likely staged, report says",0.83,http://www.latimes.com/sports/nfl/la-sp-mike-pence-nfl-20181008-story.html
563,Top,j4ck2063,2018-07-20 20:04:42,thehill.com,2,90ja6t,False,2613,5,39196,Conservative columnist: ‘I would take Obama back in a nanosecond’,0.81,http://thehill.com/blogs/blog-briefing-room/news/398112-conservative-columnist-i-would-take-obama-back-in-a-nanosecond
564,Top,theslats,2018-10-04 14:11:33,huffingtonpost.com,1,9lc8m8,False,2753,4,39188,I Lived With Brett Kavanaugh At Yale. The FBI Never Returned My Call.,0.83,https://www.huffingtonpost.com/entry/opinion-kavanaugh-fbi-investigation_us_5bb58157e4b0876eda9afeff
565,Top,Baarney23,2018-11-23 12:40:00,newsweek.com,2,9zny6g,False,5260,1,39132,Alexandria Ocasio-Cortez hits back at Fox News: ‘The same folks who bow to Trump are clutching their pearls’,0.76,https://www.newsweek.com/alexandria-ocasio-cortez-hits-back-fox-news-same-folks-who-bow-trump-are-1228662
566,Top,return2ozma,2019-03-04 00:07:05,theatlantic.com,2,ax0fxt,False,6175,6,39110,Bernie Sanders Is the Democratic Front-Runner,0.74,http://www.theatlantic.com/politics/archive/2019/02/bernie-sanders-democratic-frontrunner-president/583066
567,Top,Baarney23,2019-01-12 11:38:08,huffingtonpost.com,0,af6n3b,False,2618,12,39109,Prosecute Donald Trump To The Full Extent Of The Law,0.74,https://www.huffingtonpost.com/entry/opinion-trump-crimes-accountability_us_5c38ca9ee4b0c469d76db38c
568,Top,BigGreekMike,2018-10-28 14:56:28,theroot.com,0,9s3q17,False,2516,7,39105,Texas Voting Machines Are Reportedly Switching Votes for Beto O’Rourke to Ted Cruz,0.83,https://www.theroot.com/texas-voting-machines-are-reportedly-switching-votes-fo-1830046114
569,Top,PoliticsModeratorBot,2019-03-08 00:10:16,self.politics,1,ayjpfe,False,13444,1,39098,Megathread: Paul Manafort Sentenced to 47 Months in VA Federal Court,0.86,https://www.reddit.com/r/politics/comments/ayjpfe/megathread_paul_manafort_sentenced_to_47_months/
570,Top,maybemichaelianblack,2019-02-18 22:30:00,lawandcrime.com,2,as2zbz,False,1477,9,39083,"GOP Campaign Worker in NC Admits to Filling in Republican Votes on Absentee Ballots, Claims She Was Told to Lie",0.89,https://lawandcrime.com/high-profile/gop-campaign-worker-admits-to-filling-in-republican-votes-on-absentee-ballots-says-she-was-later-told-to-lie/
571,Top,wonderingsocrates,2019-01-16 19:52:01,thinkprogress.org,0,agoz6n,False,2388,11,39065,Lindsey Graham just accidentally admitted that suppressing black voter turnout is a core GOP goal,0.8,https://thinkprogress.org/lindsey-graham-just-accidentally-admitted-that-suppressing-black-voter-turnout-is-a-core-gop-goal-9737e804bf27/
572,Top,wonderingsocrates,2019-01-03 13:44:22,huffingtonpost.com,1,ac5u0o,False,3718,5,38927,House Democrats Start Investigating Trump This Morning,0.86,https://www.huffingtonpost.com/entry/democrats-investigate-trump_us_5c2d3e84e4b0407e9087d8b4
573,Top,tropics_,2018-06-08 15:13:57,cbc.ca,0,8pkovj,False,3153,3,38929,Canada rejects Trump's bid to let Russia back into G7,0.92,http://www.cbc.ca/news/politics/trump-russia-g7-canada-1.4697655
574,Top,melinda2020,2019-02-17 11:11:02,salon.com,0,arjnpl,False,5719,5,38906,"Scholar Matt Sears: Someday MAGA hats will be shameful secrets, like Klan robes",0.69,https://www.salon.com/2019/02/17/scholar-matt-sears-someday-maga-hats-will-be-shameful-secrets-like-klan-robes/
575,Top,Haus42,2018-06-28 10:47:24,qz.com,0,8ui64i,False,4056,3,38888,Alexandria Ocasio-Cortez’s climate plan is the only one that matches scientific consensus on the environment,0.87,https://qz.com/1316082/alexandria-ocasio-cortezs-green-new-deal-could-make-the-us-a-climate-change-leader/
576,Top,SelectiveOptimism,2018-12-16 22:47:34,newsweek.com,0,a6tsd6,False,1675,7,38886,Trump Biographer: President's Entire Campaign Was Likely A 'Criminal Conspiracy',0.81,https://www.newsweek.com/trump-biographer-presidents-entire-campaign-was-likely-criminal-conspiracy-1260835
577,Top,dr_pepper_35,2018-06-21 21:01:18,wfla.com,1,8svimy,False,2257,1,38873,Bill would keep Trump off 2020 ballot unless he releases his tax returns,0.85,https://www.wfla.com/national/bill-would-keep-trump-off-2020-ballot-unless-he-releases-his-tax-returns/1251559081
578,Top,BusbyBusby,2019-01-06 18:17:37,cbsnews.com,0,ad8303,False,4739,3,38858,"Alexandria Ocasio-Cortez says Democrats ""have compromised too much""",0.74,https://www.cbsnews.com/news/alexandria-ocasio-cortez-60-minutes-democrats-have-compromised-too-much/
579,Top,wenchette,2018-07-20 12:02:12,businessinsider.com,0,90fe0w,False,2044,3,38855,Trump flags and hats made in China are reportedly being held up at customs as trade war heats up,0.88,http://www.businessinsider.com/trump-flags-hats-made-in-china-held-at-customs-trade-war-2018-7
580,Top,StrategicMindz,2019-04-15 22:04:42,cnn.com,2,bdlx81,False,4252,7,38838,Bernie Sanders releases 10 years of tax returns,0.89,https://www.cnn.com/2019/04/15/politics/bernie-sanders-tax-returns-release-2020/index.html
581,Top,stairapprentice,2018-07-17 00:02:36,theglobeandmail.com,2,8zg92y,False,2948,3,38792,"That was treason, Donald Trump. We all saw it",0.79,https://www.theglobeandmail.com/opinion/article-that-was-treason-donald-trump-we-all-saw-it/
582,Top,Aaaahhhhhhhh_,2018-09-06 20:14:55,cnn.com,1,9dmkvj,False,3063,3,38767,Warren: Time to use 25th Amendment to remove Trump from office,0.83,https://www.cnn.com/2018/09/06/politics/elizabeth-warren-25th-amendment/index.html
583,Top,Tim_Wolf,2019-03-19 16:50:54,thinkprogress.org,0,b2zrzd,False,2133,4,38749,New report implicates Trump in same crime that’s sending Michael Cohen to jail,0.86,https://thinkprogress.org/trump-implicated-in-fraud-deutsche-bank-michael-cohen-501979c1453d/
584,Top,SometimesY,2018-06-05 00:46:53,smh.com.au,0,8omjvq,False,2916,1,38697,Manafort tried to tamper with potential witnesses: US special counsel,0.89,https://www.smh.com.au/world/north-america/manafort-tried-to-tamper-with-potential-witnesses-us-special-counsel-20180605-p4zjid.html
585,Top,Heaven_Is_Falling,2018-09-26 19:27:57,dailydot.com,0,9j5obn,False,1964,6,38680,Fox News roasted on Twitter after editing out world leaders laughing at Trump,0.87,https://www.dailydot.com/layer8/fox-news-edits-trump/
586,Top,Antinatalista,2018-12-30 14:03:41,huffingtonpost.com,0,aaw3ov,False,2293,6,38663,FBI Collected Fake Green Cards Allegedly Supplied By Trump Golf Club Managers: Report,0.87,https://www.huffingtonpost.com/entry/fbi-collects-fake-green-cards-allegedly-supplied-by-trump-club-managers-say-reports_us_5c283ceae4b0407e908346c3
587,Top,DW6565,2018-11-27 10:34:59,huffingtonpost.com,1,a0tpho,False,3271,6,38661,"Donald Trump Gets Fact-Checked By Reporter Right To His Face, Walks Away",0.83,https://www.huffingtonpost.com/entry/donald-trump-fact-checked-by-reporter_us_5bfd0cb8e4b0771fb6bda02e
588,Top,CivilBean,2019-04-28 22:53:07,rollingstone.com,1,bih5tl,False,1899,6,38614,Obama: ‘Leaders Who Feed Fear Typically Are Also Ones Who Avoid Facts’,0.83,https://www.rollingstone.com/politics/politics-news/obama-leaders-who-feed-fear-828455/
589,Top,smellslike__updog,2019-02-08 02:16:16,businessinsider.com,0,aobos4,False,3280,8,38556,"Jeff Bezos essentially accused the National Enquirer of having a political motive for exposing his affair, and insinuated a Trump connection",0.84,https://www.businessinsider.com/jeff-bezos-national-enquirer-story-affair-lauren-sanchez-politically-motivated-trump-saudi-arabia-2019-2
590,Top,Cadet-Bone-Spurs,2019-05-03 15:27:08,commondreams.org,4,bk9qlq,False,3782,6,38558,Donald Trump Is the Most Impeachable President in American History,0.76,https://www.commondreams.org/views/2019/05/03/donald-trump-most-impeachable-president-american-history
591,Top,Eurynom0s,2018-11-13 23:18:01,cnn.com,1,9wuasu,False,1090,3,38527,Former CIA officer: Trump WH helping Saudi Crown Prince cover-up murder,0.85,https://www.cnn.com/videos/tv/2018/11/13/lead-bob-baer-live-jake-tapper.cnn
592,Top,RosesAreBad,2018-08-17 17:14:29,thehill.com,0,9843pr,False,1484,3,38531,Vets group seeks to hold 5K race after Trump cancels military parade: 'One K for each of Trump's military deferments',0.88,http://thehill.com/blogs/blog-briefing-room/news/402351-vet-group-to-hold-5k-race-after-trump-cancels-military-parade
593,Top,Rednaxila,2018-07-16 16:10:17,cnn.com,0,8zc6ap,False,4893,1,38525,"Anderson Cooper: Trump-Putin presser was ""one of the most disgraceful performances by an American president""",0.83,https://www.cnn.com/politics/live-news/trump-putin-helsinki/h_c6c3a534a9a7f8cf36add3e871a196ff
594,Top,segvcore,2018-11-15 17:19:19,washingtonpost.com,1,9xd5kx,False,2782,4,38525,"Almost all of Sen. Harris’s $2.8 trillion tax plan would help middle and working class, study finds",0.85,https://www.washingtonpost.com/business/2018/11/15/almost-all-sen-harriss-trillion-tax-plan-would-help-middle-working-class-study-finds
595,Top,Creasy007,2018-07-10 23:23:11,thehill.com,3,8xue0a,False,2743,3,38513,Senate Overwhelmingly Passes Resolution Supporting NATO as Trump Attacks Continue,0.89,http://thehill.com/homenews/administration/396399-senate-overwhelmingly-passes-resolution-supporting-nato-as-trump
596,Top,nattywow,2019-01-19 22:23:23,nytimes.com,0,ahr10d,False,6630,5,38502,Boys in ‘Make America Great Again’ Hats Mob Native Elder at Indigenous Peoples March,0.77,https://www.nytimes.com/2019/01/19/us/covington-catholic-high-school-nathan-phillips.html?partner=rss&emc=rss
597,Top,wonderingsocrates,2019-01-15 20:45:35,vox.com,0,agd2s0,False,2842,6,38496,Trump tried to bypass Nancy Pelosi and negotiate with members of her caucus. None of them showed up.,0.94,https://www.vox.com/2019/1/15/18183820/trump-nancy-pelosi-house-democrats-government-shutdown
598,Top,wbedwards,2019-01-18 23:56:27,esquire.com,3,ahgmdw,False,1444,9,38475,There Is No More Loathsome Creature Walking Our Political Landscape Than Mitch McConnell,0.8,https://www.esquire.com/news-politics/politics/a25956710/mitch-mcconnell-op-ed-voting-bill-democrats/
599,Top,fartsnatch,2019-03-03 01:02:02,globalnews.ca,1,awoq9d,False,1854,0,38476,Donald Trump Jr. signed ‘hush money’ cheques in father’s affair with porn star: Cohen,0.84,https://globalnews.ca/news/5006995/trump-stormy-daniels-hush-money-michael-cohen/
600,Top,Throwawaydude01928,2018-10-18 19:50:31,newsweek.com,1,9pcm9v,False,1782,3,38424,Donald Trump Says He's Too 'Busy' to Visit U.S. Troops Overseas but Has Played Golf Almost 70 Times,0.84,https://www.newsweek.com/donald-trump-troops-busy-golf-1177157
601,Top,RosesAreBad,2018-06-29 11:06:44,independent.co.uk,1,8usa1l,False,4334,10,38427,"Maryland shooting: NRA spokeswoman Dana Loesch said journalists 'need to be curb-stomped', in resurfaced footage",0.84,https://www.independent.co.uk/news/world/americas/maryland-shooting-latest-nra-dana-loesch-journalists-gazette-gun-control-a8422566.html
602,Top,commonvanilla,2018-09-13 18:48:00,newsweek.com,0,9fkp4e,False,4233,5,38420,Brett Kavanaugh has been accused of sexual misconduct with a woman in a letter that's been passed to the FBI: Report,0.86,https://www.newsweek.com/brett-kavanaugh-accused-sexual-misconduct-1120385
603,Top,WOODEN_COUCH,2018-09-24 14:54:10,apnews.com,4,9iil46,False,3197,0,38403,The Latest: AP source says Rosenstein expecting to be fired,0.9,https://apnews.com/827b49c0e0b94d1cade89bea837927f7
604,Top,TJ_SP,2019-04-26 13:45:12,nybooks.com,3,bhmfzw,False,3291,4,38387,Mueller Prosecutors: Trump Did Obstruct Justice,0.83,https://www.nybooks.com/daily/2019/04/26/mueller-prosecutors-trump-did-obstruct-justice/
605,Top,,2018-06-18 13:33:49,vox.com,0,8rzj83,False,5025,2,38384,Trump just tweeted that “crime in Germany is way up.” It’s actually at its lowest level since 1992.,0.86,https://www.vox.com/policy-and-politics/2018/6/18/17474600/trump-tweet-crime-germany
606,Top,PoliticsModeratorBot,2018-12-20 22:41:29,self.politics,0,a83gjp,False,12037,3,38373,[Megathread] Defense Secretary Jim Mattis to Step Down in February,0.87,https://www.reddit.com/r/politics/comments/a83gjp/megathread_defense_secretary_jim_mattis_to_step/
607,Top,jlew24asu,2019-02-22 15:36:26,bloomberg.com,0,atiyn6,False,1201,1,38381,New York Has Prepared Paul Manafort Charges If Trump Pardons Him,0.88,https://www.bloomberg.com/news/articles/2019-02-22/new-york-is-said-to-prep-manafort-charges-if-trump-pardons-him
608,Top,_basquiat,2018-10-25 21:57:55,gq.com,0,9reros,False,2161,1,38364,Beto O'Rourke Earns the Endorsements of Texas' Two Largest Newspapers,0.83,https://www.gq.com/story/beto-orourke-earns-dallas-morning-news-houston-chronicle-endorsements-over-ted-cruz
609,Top,PoliticsModeratorBot,2019-02-15 15:58:52,self.politics,0,aqxz36,False,25573,5,38350,President Trump Declares National Emergency at the Southern Border,0.86,https://www.reddit.com/r/politics/comments/aqxz36/president_trump_declares_national_emergency_at/
610,Top,PoliticsModeratorBot,2018-10-24 14:04:46,self.politics,1,9qzyij,False,39748,6,38342,"Megathread: Likely Explosive Devices Addressed to Former President Obama and Former Secretary Clinton Intercepted by Law Enforcement, Linked to Device Sent to Democratic Donor George Soros",0.86,https://www.reddit.com/r/politics/comments/9qzyij/megathread_likely_explosive_devices_addressed_to/
611,Top,Fr1sk3r,2019-03-31 20:24:07,trofire.com,0,b7sa1t,False,3254,5,38299,Trump Has Allegedly Been Committing Financial Fraud For Years,0.78,https://trofire.com/2019/03/31/trump-has-allegedly-been-committing-financial-fraud-for-years/
612,Top,newnemo,2018-08-30 11:29:54,reuters.com,1,9bisrr,False,3792,4,38302,"Trump, without evidence, says NBC altered 2017 interview on Russia",0.87,https://www.reuters.com/article/us-usa-trump-russia/trump-without-evidence-says-nbc-altered-2017-interview-on-russia-idUSKCN1LF19Q
613,Top,a_very_nice_username,2018-09-19 22:52:08,nymag.com,0,9h9wyx,False,2433,5,38275,Trump Ordered the Release of Sensitive Intelligence at Sean Hannity’s Request,0.86,http://nymag.com/daily/intelligencer/2018/09/trump-released-sensitive-intel-at-sean-hannitys-request.html
614,Top,thiman,2018-12-01 19:58:38,lawandcrime.com,1,a2688g,False,1578,13,38184,Is a Do-Over Election Incoming? North Carolina Republicans Alleged to Have Committed Massive Voter Fraud,0.85,https://lawandcrime.com/high-profile/is-a-do-over-election-incoming-north-carolina-republicans-alleged-to-have-committed-massive-voter-fraud/
615,Top,EnoughPM2020,2018-11-29 17:45:52,businessinsider.com,0,a1jjlg,False,1848,2,38151,Paul Ryan says one of his biggest regrets is the ballooning federal deficit. The evidence shows he has himself to blame.,0.9,https://www.businessinsider.com/paul-ryan-federal-debt-deficit-gop-tax-law-2018-11
616,Top,ThornyPlebeian,2018-07-15 14:32:32,cbsnews.com,0,8z23q0,False,4339,4,38147,"""I think the European Union is a foe,"" Trump says ahead of Putin meeting in Helsinki",0.87,https://www.cbsnews.com/news/donald-trump-interview-cbs-news-european-union-is-a-foe-ahead-of-putin-meeting-in-helsinki-jeff-glor/
617,Top,headee,2018-07-25 10:29:08,huffingtonpost.com,2,91qnqz,False,2212,1,38141,White House Omits Critical Question From Trump-Putin Press Conference Video,0.9,https://www.huffingtonpost.com/entry/white-house-putin-trump-press-conference_us_5b5837d6e4b0fd5c73ca30ca?m=false
618,Top,westondeboer,2019-03-11 14:15:56,thinkprogress.org,0,aztxx5,False,5548,2,38136,Selling a gun without completing a background check is now a crime in New Mexico,0.87,https://thinkprogress.org/selling-a-gun-without-completing-a-background-check-is-now-a-crime-in-new-mexico-6043f7b25b78/
619,Top,The-Autarkh,2018-07-17 10:57:31,washingtonpost.com,5,8zk5bc,False,3896,1,38133,We just watched a U.S. president acting on behalf of a hostile power,0.83,https://www.washingtonpost.com/amphtml/news/global-opinions/wp/2018/07/16/we-just-watched-a-u-s-president-acting-on-behalf-of-a-hostile-power/
620,Top,dannlee,2019-02-15 17:31:00,thehill.com,1,aqyyhe,False,1928,6,38064,CBS leaves Trump for 'The Price is Right',0.86,https://thehill.com/homenews/media/430218-cbs-leaves-trump-for-the-price-is-right
621,Top,wonderingsocrates,2018-08-25 17:21:37,newsweek.com,0,9a8fna,False,2271,3,38054,"Trump Has Spent 150 Days, Or 25 Percent, of His Presidency at Trump golf clubs",0.88,https://www.newsweek.com/trump-150-days-presidency-trump-golf-club-1090729
622,Top,pipsdontsqueak,2018-08-24 14:49:54,cnbc.com,2,99y1dy,False,6671,4,38017,"Longtime Trump Organization CFO Weisselberg granted immunity in Cohen probe: DJ, citing sources",0.91,http://cnbc.com/id/105410499
623,Top,trippypolitics,2019-02-20 19:17:20,buzzfeednews.com,0,asse20,False,1152,2,37988,A Former Trump Staffer Filed A Class Action To Invalidate All Of The Campaign’s Nondisclosure Agreements,0.87,https://www.buzzfeednews.com/article/zoetillman/trump-campaign-nondisclosure-agreements-class-action-lawsuit
624,Top,Stoga,2018-12-24 18:50:48,nbcnews.com,0,a97lkr,False,3948,7,37991,Dow drops 653 points in worst Christmas Eve trading day ever,0.89,https://www.nbcnews.com/business/markets/dow-drops-653-points-worst-christmas-eve-trading-day-ever-n951661
625,Top,schmuck_next_door,2019-03-23 01:27:33,thehill.com,3,b4d9w4,False,1317,7,37991,Wisconsin Dem governor removes 82 Scott Walker appointees added during lame-duck session,0.89,https://thehill.com/homenews/state-watch/435390-wisconsin-dem-governor-removes-82-scott-walker-appointees-added-during?amp&__twitter_impression=true
626,Top,progress18,2018-10-04 11:47:42,washingtonpost.com,0,9lb5ky,False,3860,2,37989,"‘Unfathomable’: More than 1,200 law professors sign letter opposing Kavanaugh’s confirmation",0.82,https://www.washingtonpost.com/education/2018/10/04/unprecedented-unfathomable-more-than-law-professors-sign-letter-after-kavanaugh-hearing/
627,Top,Pomp_N_Circumstance,2019-02-13 11:12:04,independent.co.uk,0,aq5igy,False,2232,4,37973,Trump aide Sarah Sanders ridiculed for suggesting Mexico border wall would have stopped El Chapo,0.84,https://www.independent.co.uk/news/world/americas/us-politics/trump-sarah-sanders-el-chapo-border-wall-mexico-drugs-trial-sentence-a8776866.html
